full_text,tweet_english
pak ganjar prof mahfud tunjuk sungguh libat perempuan lebih luas dunia perintah sama ganjar sejahtera ganjarmahfud ganjarpresidenrakyat coblos,Pak Ganjar Prof. Mahfud pointed out that women were really wider the world's commands with Ganjar Sejahtera Ganjarmahfud Ganjarpresidenrakyat Coblos
lihat aktivitas diam calon presiden ganjar pranowo jelang berangkat tuju lokasi tempat mungut suara lurah lempongsari semarang rabu pagi irf beritaelshinta,See the Silence of Presidential Candidate Ganjar Pranowo ahead of going to the location of the location where the Lempongsari Village Chief Semarang Semarang Wednesday Morning Irf Berkelshinta
kali saya sepakat roky ganjar jauh watak karakter orang pimpin pilih periode jadi gubernur jawa tengah hany pengaruh jokowi partai demokrasi indonesia juang jokowi partai demokrasi indonesia juang ganjar bukan siapa salah satu anggota dewan wakil rakyat ratus anggota,"times I agreed that Roky Ganjar was far away in the character of the character of the Lead to choose the period to become the Governor of Central Java, it was only the influence of Jokowi, the Indonesian Democratic Party of Democracy, Jokowi, the Indonesian Democratic Party, Ganjar was not one of the members of the People's Representative Council."
tenang pak luar negeri ganjar menang,"Calm down, Ganjar's overseas wins"
mesti kita bangga atas produksi lokal pak ganjar sampai bangga sepatu produk lokal harga sangat jangkau cuma rupiah ribu itu sampai unjung pasar kapuas indah pontianak,We must be proud of Pak Ganjar's local production to proud that Local Product Shoes Prices are very reach for only rupiah thousand until the Kapuas Indah Pontianak market
program lapak ganjar sekadar cipta peluang bisnis juga beri dukung komprehensif para laku usaha ganjar pranowo hanya dia betul rakyat akan buat lebih rakyat ganjarmahfud ganjarpresidenrakyat coblos,"The Ganjar stall program is just a business opportunity to also support the comprehensive business behavior of Ganjar Pranowo, only the people will make the people of Ganjarmahfud GanjarPresidatakyat Coblos"
responsif tanpa pepes kosong mas ganjar pimpin milik tindak nyata penting rakyat dukung penuh pimpin efektif ganjar pranowo kamu hak dapat baik ganjarmahfud dulujokowisekarangganjar coblos,Responsive without empty pepes mas Ganjar leaders owned by real actual act of the people fully supported the Effective Leaders of Ganjar Pranowo You Right to be good Ganjarmahfud DulujokowowiSangganjar Coblos
wah ganjar pranowoprof mahfud punya ide cemerlang kartu tanda duduk sakti data jadi lebih akurat ksejahteraan sosial naik sama ganjar sejahtera ganjarmahfud dulujokowisekarangganjar coblos,"Wah Ganjar Pranowoprof Mahfud has a brilliant idea of ​​the Sakti Sakti Data Sitting Card to be more accurate, social welfare rises with Ganjar Sejahtera Ganjarmahfud DulujokowiSangganjar voting"
generasi muda yakin ganjarmahfud punya bijak konkret kualitas ganjar pranowo kamu hak dapat baik ganjarmahfud dulujokowisekarangganjar coblos,The younger generation believes that Ganjarmahfud has a concrete wise quality Ganjar Pranowo you right can be good ganjarmahfud dulujokowisangganjar voting
gas pol terus ketua siap dukung ganjar mahfud pilih presiden,Gas Pol continues the Chairperson is ready to support Ganjar Mahfud to Choose the President
ganjar pranowo pionir kembang semangat cinta pndidikan kalang masyarakat sama ganjar sejahtera  ganjarmahfud salammtal coblos,Ganjar Pranowo Pioneur Flower Spirit of Love Education Kalang Society and Ganjar Sejahtera Ganjarmahfud Salammtal Coblos
ganjarmahfud yakin hasil surveisurvei ini meleset sebut bukti tanggal februari,Ganjar Mahfud believes the results of this survey survey have missed the proof of February
masyarakat cirebon medan yoyakarta lihat dekat visi misi pak ganjarprof mahfud cermin semangat kampanye akbar begitu pukau ganda sejahtera raih makmur lanjut ganjarmahfud ganjarpresidenrakyat coblos,Cirebon Medan Yogyakarta community See close to the vision and mission of Mr. Ganjar Prof. Mahfud Cermin the spirit of the grand campaign as well as the waters of the prosperous Ganda Makmur continued Ganjarmahfud Ganjarpresidenakyat Coblos
pasang ganjar jawa banget mahfud sangat madura mana orang madura sangat anti partai demokrasi indonesia juang pasang gibran yakin kerja pakde susun jauh hari,Install Ganjar Jawa really mahfud is very Madura where Madurese are very anti -Indonesian Democratic Party in Pair Gibran believes that Pakde's work is arranged in advance
manfaat hari tenang masa coblos ganjar istri sempat healing tipistipis mal pakuwon yogyakarta datang sambut gembira swafoto jadi momen sama calon kepala negara yakinpilihganjar ganjarpranowo ganjarmahfud,Benefits of the Calm Day of the Ganjar Wife Coblos Had Healing Typictice Mall Pakuwon Yogyakarta came to welcome the selfies so the moment with the candidate for the head of state was sure that the selection of ganjarpranowo ganjarmahfud
semangat smut hitam inspirasi masyarakat jabar aksi ganjar pranowo kamu hak dapat baik ganjarmahfud ganjarpresidenrakyat coblos,the spirit of the black smut inspiration for the people of West Java Ganjar Pranowo Action You Right to be good Ganjarmahfud Ganjarpresidenakyat Coblos
prof mahfud md bukti politik bukan halang tetap fokus tugas perintah ganjar pranowo yang baik rakyat ganjarmahfud ganjarpresidenrakyat coblos,"Prof. Mahfud MD Political Evidence is not the focus of the focus of the task of Ganjar Pranowo's command, the people of Ganjarmahfud Ganjarpresidenakyat Coblos"
ganjar pranowo mahfud md jadi solusi cerdas akselerasi industri digital khusus dorong cipta aplikasi nasional dukung usaha mikro kecil tengah lokal ganda sejahtera raih makmur ganjarmahfud dulujokowisekarangganjar coblos,Ganjar Pranowo Mahfud MD is a smart solution for the acceleration of the digital industry specifically to encourage the Cipta National Application Supporting Micro Small Micro Business Middle Local Prosperous Makmur Ganjarmahfud Dulujokowowisangganjar Coblos
ksehatan desadesa makin tingkat berkat program ganjarmahfud ganjar pranowo kamu hak dapat baik ganjarmahfud dulujokowisekarangganjar coblos,Village Health is increasing thanks to the Ganjar Mahfud Ganjar Pranowo program.
ngeri pak ganjar,Horrified Mr. Ganjar
ganjarmahfud bukan cuma pasang calon wakil presiden juga pasang siap jaga ksehatan masyarakat ganjar pranowo bukti lebih baik ganjarmahfud dulujokowisekarangganjar coblos,Ganjarmahfud is not just a pair of vice -presidential candidates also pairs ready to guard the health of the community Ganjar Pranowo Evidence is better for Ganjarmahfud DulujokowowiSangganjar voting
libat ganjarmahfud seni gambar ingin rangkul agam ganjar pranowo dia betul rakyat akan buat lebih rakyat ganjarmahfud salammtal coblos,"See Ganjar Mahfud Art Picture wants to embrace Ganjar Pranowo's religion, he's really the people will make the people of Ganjarmahfud Salammtal Coblos"
model mas mas jawa kayak ganjar bapak bapak aji kayak bilang mulut jahat banget tau ya mulut ahok bagaimana,"Mas Mas Mas Jawa Model like Ganjar Mr. Aji like saying the mouth is really evil, you know what Ahok's mouth"
grup belah sebar hoaks ganjar tinggal simpatisan ngehoax kok gila,Group Split Hoaks Ganjar Live Ngehoax sympathizers why are you crazy
dukung sepenuh hati ganjar pranowomahfud milik visi luar biasa cipta lapang kerja baru sejahtera rakyat indonesia sejahtera kali lipat indonesia hebat ganjarmahfud ganjarpresidenrakyat coblos,"Support wholeheartedly, Ganjar Pranowomahfud belongs to the extraordinary vision of the Cipta New Work Cipta, prosperous Indonesian people, prosperous Indonesia, Ganjarmahfud GanjarPresidatrakyat Coblos"
ganjarmahfud jawab tantang zaman gagas segar jiwa muda ganjar pranowo yang baik rakyat ganjarmahfud ganjarpresidenrakyat coblos,"Ganjar Mahfud answered about the era of the fresh ideas of the young spirit of Ganjar Pranowo, the good people of Ganjarmahfud GanjarPresidenrakyat Coblos"
ganjar idola baru buat anakanak sekolah ingin punya pimpin benerbener peduli sama didik ganjar pranowo yang baik rakyat ganjarmahfud salammtal coblos,Ganjar new idol for school children want to have a leader really care about Didik Ganjar Pranowo who is good people Ganjarmahfud Salammtal votes
ari ri ganjar presiden,Ari RI Ganjar President
mas ganjar bahas program makan siang gratis dan internet gratis bang senyum manis,Mas Ganjar Discussing Free Lunch Program and Free Internet Bang Sweet Smile
senyum sumringah mgr paskalis bruno syukur para imam uskup sufragan bogor sambut datang dan istri katedral bogor siang tadi ajak keliling gedung katedral bangun ini buah sudut gereja foto presiden soekarno,"happy smile mgr Paskalis Bruno gratitude for the bishop of Sufragan Bogor welcomed and the wife of the Bogor Cathedral this afternoon invited around the Cathedral Building Building, the corner of the Church of the Photo of President Soekarno"
lalu sekolah tengah juru gratis pak ganjar beri dorong besar anakanak muda mimpi lebih tinggi wujud ganjar pranowo bukti lebih baik ganjarmahfud ganjarpresidenrakyat coblos,then the middle school of the free interpreter Mr. Ganjar gave a big encouragement young children's dream higher the form of Ganjar Pranowo Evidence Better Ganjarmahfud Ganjarpresidenakyat Coblos
tiap diskusi pak ganjar sebut salam metal komitmen hadir ubah positif ganjar pranowo dia betul rakyat akan buat lebih rakyat ganjarmahfud dulujokowisekarangganjar coblos,"Every discussion Pak Ganjar calls Salam Metal Commitment to attend positive changes Ganjar Pranowo, he is really the people will make the people of Ganjarmahfud DulujokowiSangganjar Plot"
warga jawa barat yakin ganjar beri solusi efektif tangan masalah anggur tingkat kualitas didik daerah ganjar pranowo yang baik rakyat ganjarmahfud salammtal coblos,"West Java citizens are sure that Ganjar gives an effective solution to the grape problem of the quality of the student quality of the Ganjar Pranowo region, the good people of Ganjarmahfud Salammtal Coblos"
ras kuat bumi,the earth's strong race
caprs cawaprs harap juta rakyatt ganjar pranowoprof mahfud jadi pilar adil tara ganjar pranowo kamu hak dapat baik agusti ganjarmahfud ganjarpresidenrakyat coblos,CAPRS CAWAPRS hopes that millions of people Ganjar Pranowoprof Mahfud will be a fair pillar of Tara Ganjar Pranowo.
justzhi punya bukti testimoni dukung komunitas mana pokok ganjar paling toleran lah siap intoleran pokok semua salah anies,"Justzhi has evidence of testimonials to support the community which is the most tolerant principal, ready tolerant, all the principal"
benar alas gue ragu pak ganjar cuma partai demokrasi indonesia juang kalau ada pak pasti gue pilih sih,"It's true that my base is doubtful, Mr. Ganjar, only the Indonesian Democratic Party, if there is a sir, I will choose"
ganjar mahfud implementasi kebijakankebijakan tuju tingkat daya beli masyarakat imbang harga barang butuh ganjar pranowo dia betul rakyat akan buat ganjarmahfud dulujokowisekarangganjar coblos,"Ganjar Mahfud Implementation of the Policy Policy Seven Levels of Power Power Community Draw the price of goods needs Ganjar Pranowo, he is really the people will make Ganjarmahfud DulujokowiSangganjar Coblos"
ganjar pranowo bukti jujur berani ubah paradigma perintah lihat capai tinggi pnilaian intgritas ganjar pranowo bukti lebih baik mh ganjarmahfud ganjarpresidenrakyat kratonbersamarakyat,Ganjar Pranowo Honest Proof of Dare to Change Paradigm Order See Highly Assessment of Ganjar Pranowo Intgritas Evidence better MH Ganjarmahfud GanjarPresidenrakyat KratonBersamarakyat
tiap langkah ganjar mahfud gandeng salam metal cipta simbiosis mutualisme masyarakat sama ganjar sejahtera black ganjarmahfud dulujokowisekarangganjar coblos,Every step of the Ganjar Mahfud Cooperates Salam Metal Cipta Symbiosis Mutualism of the community and Ganjar Sejahtera Black Ganjarmahfud DulujokowiSangganjar Publos
salam metal dengar hati warga jawa barat berkobarkobar tanda semangat juang untuk dukung ganjar mahfud ganjar pranowo bukti lebih baik ganjarmahfud dulujokowisekarangganjar coblos,Greetings Metal Hearing the Hearts of West Java Citizens Bertled the Sign of Fighting to Support Ganjar Mahfud Ganjar Pranowo Evidence Better Ganjarmahfud DulujokowowiSangganjar Coblos
ganjarmahfud aku pimpin tidak visioner juga milik peka moral etika warna hidup masyarakat ganjar pranowo dia betul rakyat akan buat lebih ganjarmahfud ganjarpresidenrakyat coblos,"Ganjar Mahfud I am an Unexpensive Leader also belongs to the moral sensitive ethics of the life of the community of Ganjar Pranowo, he is really the people will make more Ganjarmahfud Ganjarpresidenakyat votes"
siswanto partai usung orang hitung untung rugi masuk peluang menang asal jangan lupa partai demokrasi indonesia juang pernah tes elektabilitas likeability puan pasang baliho besar an kepak sayap bineka narasi puanesia hasil kecil makanya kemudian usung ganjar,"Siswanto The party stretches the profit and loss to enter the chance of winning as long as you don't forget the Indonesian Democratic Party has an electability test for the likes of the big billboards and the pensions of the pipeka narrative, the small results, so then the trails of Ganjar"
me for alam ganjar,Me for Alam Ganjar
mimpi paling random jauh adalah partner double badminton sama pak ganjar,The most random dream is a double badminton partner with Mr. Ganjar
amat ganjarmahfud sangat mungkin bentuk kabinet ahli ketua komisi pemelihan umum jokowi inul raja indonesia banjir hoaks rocky gerung bahlil mandi makan gratis tanda rental play station badan selenggara jamin sosial tasya farasya ganjarmahfud yakinpiihganjar ganjarpranowo,Very Ganjarmahfud is very possible the form of the Cabinet Expert Chairperson of the Jokowi General Pemliping Commission Inul Raja Indonesia Flood Rocky Rocky Bahlil Bahlil Bathing FREE RENTAL SIGNS OF PLAY STATION AGENCY AGENCY SOCIAL SOCIAL TASYA FARASYA GANDARMAHFUD YAKAIPIIHGANGANGANGANGRANPANO
mas ganjar bukan mimpi juga wujud impi jadi prestasi nyata dunia didik sama ganjar sejahtera ganjarmahfud salammtal coblos,Mas Ganjar is not a dream also a form of an impi so the real achievement of the world of Didik and Ganjar Sejahtera Ganjarmahfud Salammtal Coblos
dukung purnawirawan jenderal tnipolri ganjarmahfud makin percaya diri menang pilih presiden sekolah dasar gelora bung karno tidur menteri banyuwangi pagi fedi nuril,Support Retired General Tnipolri Ganjarmahfud is increasingly confident winning to choose the President of the Bung Karno Elementary School Sleep Minister Banyuwangi Pagi Fedi Nuril
selamat pagi pagi hari enak makan bubur akhir pekan jangan lupa libur,good morning morning good eating porridge weekend don't forget to take a day off
ganjar pranowo calon presiden tidak milik wawas luas stunting juga tindak konkret wujud ganjar pranowo bukti sejahtera ganjarmahfud dulujokowisekarangganjar coblos,"Ganjar Pranowo Presidential Candidate does not belong to the Wawas Broad Stunting, also a concrete act of Ganjar Pranowo Prosperous Evidence of Ganjarmahfud DulujokowowiSangganjar Coblos"
ganjar pranowo bikin yakin kalau didik jadi kuat besar ubah masa depan bangsa ganjar pranowo kamu hak dapat baik biiiii ganjarmahfud salammtal coblos,Ganjar Pranowo makes sure that Didik becomes strong to change the future of the nation of Ganjar Pranowo you are right to be good biiiii ganjarmahfud salammtal votes
pak ganjar pak mahfud wakil harap rakyat masa depan lebih baik sama ganjar sejahtera ganjarmahfud ganjarpresidenrakyat kratonbersamarakyat,Pak Ganjar Pak Mahfud Deputy hopes that the people of the future will be better with Ganjar Sejahtera Ganjarmahfud Ganjarpresidat KratonBersamarakyat
ganjar pranowo program unggul cepat turun angka stunting tahap ganjar pranowo kamu hak dapat baik ganjarmahfud dulujokowisekarangganjar coblos,Ganjar Pranowo Program Superior Fast Stunting Figures Stage Ganjar Pranowo You Right to Be Good Ganjarmahfud DulujokowiSangganjar Publos
ganjarmahfud wujud harap tingkat tahan pangan nasional ganjar pranowo bukti lebih baik ganjarmahfud ganjarpresidenrakyat coblos,"Ganjar Mahfud, hope that the level of national food resistance Ganjar Pranowo is better proof"
bijak tegas posisi ganjarmahfud pimpin prioritas investasi bidang didik ganjar pranowo dia betul rakyat akan buat lebih rakyat ganjarmahfud dulujokowisekarangganjar coblos,"wisely the position of Ganjarmahfud leads to the priority of investment in the field of Didik Ganjar Pranowo, he is really the people will make the people of Ganjarmahfud DulujokowiSangganjar Koblos"
warga semarang yakin ganjar mahfud bawa ubah positif kota negara ganjar pranowo dia betul rakyat akan buat lebih rakyat ganjarmahfud dulujokowisekarangganjar coblos,"Semarang residents are sure that Ganjar Mahfud brings positive changes in the city of Ganjar Pranowo, he is really the people will make more people of Ganjarmahfud DulujokowiSangganjar voting"
ganjar pranowoprof mahfud presiden rakyat beri harap baru bangun a depan lebih baik beri sempat semua sekolah tinggi ganjar pranowo yang baik rakyat ganjarmahfud ganjarpresidenrakyat coblos,"Ganjar Pranowoprof Mahfud The people of the people give hope that just wake up ahead, better give all the good Ganjar Pranowo high schools Ganjarmahfud GanjarPresidenakyat Coblos"
ganjarmahfud lihat politik bukan penting pribadi juga tentang abdi masyarakat ganjar pranowo bukti sejahtera ganjarmahfud salammtal coblos,Ganjarmahfud sees politics is not personal important also about the community of Ganjar Pranowo Society of Prosperous Ganjarmahfud Salammtal Coblos
jadi harus maklum sudah hajar bonyok harus maklum jadi salah paham spanduk hg bawak o dukung ganjar mahfud sebut guna bahasa sansekerta salam waras amp negara satu republik indonesia,"So you have to be understandable, I have to be happy, you have to be a misunderstanding of the HG banner to support Ganjar Mahfud."
sikap tegas ganjar pranowo cermin komitmen tika jujur kelola perintah ganjar pranowo bukti sejahtera ganjarmahfud ganjarpresidenrakyat coblos,Ganjar Pranowo's firm attitude Mirror Commitment Tika honestly manages Ganjar Pranowo's orders for prosperous Ganjarmahfud GanjarPresidenrakyat Coblos
ganjarmahfud inspirasi semua jaga nilai moral etika segala aspek hidup sama ganjar sejahtera ganjarmahfud ganjarpresidenrakyat coblos,Ganjarmahfud Inspiration All Maintain Moral Values ​​of Ethics All aspects of Life are the same as Ganjar Sejaratra Ganjarmahfud Ganjarpresidenakyat Coblos
langkah perempuan indonesia kontribusi arti mnangkan ganjarmahfud ganjar pranowo bukti sejahtera ganjarmahfud ganjarpresidenrakyat kratonbersamarakyat,Indonesian Women's Steps to Contribute to the meaning of the Ganjarmahfud Ganjar Pranowo Evidence of Prosperous Ganjarmahfud GanjarPresidatrakyat KratonBersamarakyat
buzzer ganjar kalau datang sama bagaimana enggak bareng akun banyak operator orang seragam ikut baru lahir akhir tahun lalu semua akun,"Buzzer Ganjar if it comes the same, how not together with the accounts of many uniform operators in the newborn at the end of last year all accounts"
calon presiden nomor urut ganjar pranowo kata tiga jenderal turut berubahubah alias menclamencle ganjar sebut tiga jenderal sebut purnawirawan satu antara menteri ekonomi marves jenderal tentara nasional indonesia purna luhut binsar panjaitan,Presidential candidate number Ganjar Pranowo said three generals also changed alias ganjar calling three generals call retired one between the Minister of Economics Marves General of the Indonesian National Army Full Luhut Binsar Panjaitan
ganjar bukti dia milik mampu jawab tantang masa depan ganjar pranowo kamu hak dapat baik ganjarmahfud dulujokowisekarangganjar coblos,"Ganjar Evidence he is able to answer about the future of Ganjar Pranowo, you can be good at Ganjarmahfud DulujokowiSangganjar Coblos"
papar penuh pikir rasional partai belenggu ganjarmahfud partai juga akan pihak baik benar sekaligus bawa maslahat banyak orang mahfud tugas konstitusi bukan oligarki,said the rational thinking of the party of the shackles of the party ganjarmahfud the party will also be good parties and at the same time bring the benefits of many mahfud the constitutional tasks are not oligarchy
ganjarmahfud bukan batas slogan visi cipta masa depan lebih baik ganjar pranowo bukti sejahtera ann ganjarpresidenrakyat ganjarmahfud coblos,Ganjarmahfud is not the limit of the slogan vision of the future better Ganjar Pranowo Evidence of Prosperous Ann GanjarPresidat Ganjarmahfud Coblos
yakin buat dukung ganjar mahfud pasti,sure to support Ganjar Mahfud for sure
bandung sidoarjo rasa hadir penuh arti ganjar pranowo prof mahfuddalam kampanye akbar pimpin dengar peduli ganjar pranowo bukti lebih baik  ganjarmahfud ganjarpresidenrakyat coblos,Bandung Sidoarjo feels full of presence meaning Ganjar Pranowo Prof. Mahfuddid in the grand campaign leads to care about Ganjar Pranowo Evidence better Ganjarmahfud Ganjarpresidenrakyat Coblos
alam ganjar tentang arti amanah orang pemimpinjangan pernah khianat amanah ganjar pranowo komitmen akan pernah kecewa tinggal rakyat percaya dukung calon presiden pilih umum,Nature of Ganjar about the meaning of the mandate of the Objectives of the Amanah Amanah Ganjar Pranowo Commitment will never
ganjar bawa inovasi ubah signifikan tata kelola perintah jawa tengah ganda sejahtera raih makmur lanjut ganjarmahfud salammtal coblos,Ganjar Bring Innovation Change Significant Management of Central Java Command Orders Prosperous Makmur Continued Ganjarmahfud Salammtal Coblos
konser salam mtal jadi puncak gembira rakyat tanda ganjar mahfud pilih tepat bawa bangsa ke arah lebih baik sejahtera kali lipat indonesia hebat ganjarmahfud dulujokowisekarangganjar coblos,The Salam Mtal concert became the peak of the people of Ganjar Mahfud to choose right to bring the nation to the better better prosperous Indonesia Ganjarmahfud DulujokowowiSangganjar Coblos
bijak cermin visi ganjarmahfud didik inklusif rata seluruh indonesia ganjar pranowo bukti sejahtera ganjarmahfud dulujokowisekarangganjar coblos,wise mirror vision of Ganjarmahfud Didik Inclusively All All Indonesia Ganjar Pranowo Proof of Prosperous Ganjarmahfud DulujokowowiSangganjar voting
ganjar mahfud tampil berani jujur kampanye akbar semarang sama ganjar sejahtera lomondx ganjarmahfud dulujokowisekarangganjar coblos,Ganjar Mahfud appeared brave to be honest with the grand campaign of Semarang and Ganjar Sejahtera Lomondx Ganjarmahfud DulujokowiSangganjar Boblos
ganjar pranowoprof mahfud ayo juang pihak perempuan indonesia kartini maju jadi harap ganjar pranowo yang baik rakyat  ganjarmahfud dulujokowisekarangganjar coblos,Ganjar Pranowoprof Mahfud Ayo Fighting Indonesian Women Kartini Forward So Hopefully the Good Ganjar Pranowo Ganjarmahfud DulujokowowiSangganjar Coblos
salam mtal hajat rakyat ganjarmahfud konser salam metal menang total sabtu februari gelora bung karno gelora bung karno jakarta gratis datang ramairamai dress code hitam putih guncang gelora bung karno ganjarmahfud ganjarpresidenrakyat salammtal,Greetings Mtal Hajat Rakyat Rakyat Ganjarmahfud Salam Metal Concert Winning Total Saturday February Gelora Bung Karno Bung Karno Jakarta Come Ramairama Dress Code Black and White Dress Gelora Bung Karno Ganjarmahfud GanjarpresiTaiyat Salammtal
mas ganjar pilih tepat buat jadi pimpin soal beliau tunjuk serius beri didik kualitas jawa tengah ganjar pranowo kamu hak dapat baik ganjarmahfud salammtal coblos,Mas Ganjar Choose Right To Be Leading Problem He Applies Seriously Give Students of Central Java Quality Ganjar Pranowo You Right Can Be Good Ganjarmahfud Salammtal Broken
partisipasi aktif masyarakat konser salam mtal jadi bukti nyata dukung ganjar mahfud makin kuat ganjar pranowo dia betul rakyat akan buat lebih rakyat  ganjarmahfud dulujokowisekarangganjar coblos,Active Participation of the Salam Salam Concert Community So the Real Proof of Supports Ganjar Mahfud The stronger Ganjar Pranowo he is really the people will make the people of Ganjarmahfud DulujokowiSangganjar Coblos
ganjar pranowo kpps tempat mungut suara,Ganjar Pranowo KPPS where they collect votes
kombinasi berani ganjar pranowo arif prof mahfud cipta harmoni sempurna sama ganjar sejahtera ganjarmahfud dulujokowisekarangganjar coblos,The brave combination of Ganjar Pranowo Arif Prof. Mahfud Cipta Harmoni Perfect and Ganjar Sejahtera Ganjarmahfud DulujokowiSangganjar Boblos
agam masyarakat lihat dukung penuh hajat rakyat salam mtal tunjuk pak ganjar pak mahfud mampu satu bagai elemen ganjar pranowo bukti sejahtera ganjarmahfud slankganjarmahfud coblos,Religion of the community seeing the full support of the people's celebration Salam Metal Appoint Pak Ganjar Pak Mahfud is able to be like an element of Ganjar Pranowo Evidence of Prosperous Ganjarmahfud Slankganjarmahfud Coblos
usia lanjut bukan hambat ganjarmahfud agas program jamin lanjut usia produktif sahabatganjar ganjarpresiden ganjaruntuksemua ganjarmahfud satsetlebihbaik,"The elderly are not obstacles to Ganjar Mahfud, Gagas, the Estimated Elderly Guarantee Program, SahabatGanjar Ganjar, Ganjar, Ganjar for all of the Ganjarmahfud Satel"
pilih pimpin wawas pilih ganjarmahfud ganjar pranowo dia betul rakyat akan buat lebih rakyat ganjarmahfud ganjarpresidenrakyat coblos,Choose Wawas Leader Choose Ganjar Mahfud Ganjar Pranowo He is right the people will make the people of Ganjarmahfud GanjarPresidenrakyat Coblos
dukung ganjar pranowo caprs cawaprs tekad kuat lawan korupsi bagaimana ungkap prof ganjar pranowo bukti sejahtera ganjarmahfud ganjarpresidenrakyat coblos,Support Ganjar Pranowo Caprs Cawaprs strong determination to corruption how to reveal Prof. Ganjar Pranowo Proof of Prosperous Ganjarmahfud GanjarPresidenrakyat Coblos
arti jangan pilih ganjar,Meaning Don't Choose Ganjar
