full_text,tweet_english
partai demokrasi indonesia juang kota surabaya mantap ribu saksi aman awal menang partai demokrasi indonesia juang pasang ganjarmahfud wakil sekretaris dewan pimpin cabang partai demokrasi indonesia juang kota surabaya achmad hidayat ungkap saksi milik tanggung jawab,The Indonesian Democratic Party of the Surabaya City Fighting Mental Thousands of Safe Witnesses Early Winning the Indonesian Democratic Party Juang paid Ganjarmahfud Deputy Secretary of the Indonesian Democratic Party Branch Council in Surabaya City Achmad Hidayat said the witness belongs to the responsibility
respons tkn prabowogibran soal ahok dukung ganjarmahfud too little too late,Response TKN Prabowo Gibran about Ahok Supports Ganjar Mahfud too Little too late
perempuan indonesia maju sama ganjar mahfud ganjarmahfud ganjarpresidenrakyat kratonbersamarakyat,"Indonesian women advanced with Ganjar Mahfud Ganjar Mahfud Ganjar, President of the people of Kratonbersamarakyat"
baru negeri konoha presiden rangkap jadi menteri sosial yuk jalan bulan februari sama ganjarmahfud,"Only the Konoha State of the president duplicated as the Minister of Social Affairs, the road in February with Ganjarmahfud"
warganet antusias dukung ganjar mahfud langkah positif prof mahfud tiga kali lebih sejahtera indonesia jaya ganjarmahfud ganjarpresidenrakyat coblos,"Enthusiastic citizens support Ganjar Mahfud, positive step Prof. Mahfud is three times more prosperous Indonesia Jaya Ganjarmahfud Ganjarpresidenrakyat votes"
ganjarmahfud bangun indonesia sehat sukses ganjar bangun sehat masyarakat jawa tengah jadi cermin dedikasi sejati ganjar pranowo kamu hak dapat baik ganjarpresidenrakyat ganjarmahfud coblos,Ganjarmahfud Bangun Indonesia Sehat Successful Ganjar Bangun HEALTHY CENTRAL JAVA COMMUNITY BECOME A MIND DEDDICATION True Ganjar Pranowo You Right to Be good
prabski maaf kalau lama ada salah kata pak ganjar jangan pilih pimpin otoriter jahat ham,"Prabski sorry if there was a wrong word, Mr. Ganjar, don't choose to lead the bad authoritarian human rights"
kalimantan barat ganjar,West Kalimantan Ganjar
mas ganjar punya rekam jejak bagus didik sehat sempat kerja jadi fokus utama sama ganjar sejahtera ganjarmahfud dulujokowisekarangganjar coblos,"Mas Ganjar has a good track record of Didik Sehat, I worked so the main focus was the same as Ganjar Sejahtera Ganjarmahfud DulujokowiSangganjar Boy"
kota semarang bukti dukung ganjar mahfud bukan sekadar simpul politik ikat emosional sulit ukur ganjar pranowo kamu hak dapat baik karta ganjarmahfud dulujokowisekarangganjar coblos,Semarang City Evidence of supporting Ganjar Mahfud is not just a political node of emotional tie it difficult to measure Ganjar Pranowo you right to be good Karta Ganjarmahfud DulujokowowiSangganjar Coblos
cuma janji manis ganjar pranowoprof mahfud punya program nyata buat bantu masyarakat khusus cgah stunting ganjar pranowo yang baik rakyat ganjarmahfud dulujokowisekarangganjar coblos,"Only the sweet promise of Ganjar Pranowoprof Mahfud has a real program to help the special community of CGAH Stunting Ganjar Pranowo, the good people of Ganjarmahfud DulujokowowiSangganjar Coblos"
menang ganjar bukan ganjar menang mahfud bukan mahfud menang kita semua adi napitupulu hajat rakyat bogor februari ganjarmahfud asalbukan,Winning Ganjar Not Ganjar Winning Mahfud Not Mahfud Winning Us All Adi Napitupulu Hajat People Bogor February Ganjarmahfud Origin
dukung ganjarmahfud komunitas seni tunjuk percaya kebijakankebijakan progresif tiga kali lebih sejahtera indonesia jaya ganjarmahfud salammtal coblos,"Supports Ganjarmahfud, the Art Community, Proposal to believe in progressive policies three times more prosperous Indonesia Jaya Ganjarmahfud Salammtal votes"
jejak digital pampang nyata,Real digital traces
ganjar main rapper,Ganjar play rapper
mas ganjar prof mahfud paham stabilitas harga barang butuh kunci cipta kondisi ekonomi sehat lanjut sama ganjar sejahtera ganjarmahfud dulujokowisekarangganjar coblos,Mas Ganjar Prof. Mahfud Understanding the Stability of the Price of Goods Needs Cipta Key Conditions Healthy Economic Conditions with Ganjar Sejahtera Ganjarmahfud DulujokowiSangganjar Boblos
well even pak ganjar being a backburner,well even pak ganjar being a backburner
calon presiden paham rakyat kecil ganjar muncul gemilang debat ganjar pranowo bukti sejahtera frdus ganjarmahfud ganjarpresidenrakyat coblos,Presidential Candidate Understanding Little People Ganjar Appears Ganjar Pranowo Debate Evidence Prosperous FRDUS Ganjarmahfud Ganjarpresidenrakyat Coblos
performa ganjar debat malam tunjuk dalam paham isuisu nasional ganjar pranowo bukti lebih baik ganjarmahfud dulujokowisekarangganjar coblos,Ganjar Performance of the Night Debate shows in the understanding of national issue Ganjar Pranowo Evidence is better Ganjarmahfud DulujokowiSangganjar votes
model ganjar kampanye kayak begini justru sebab suara turun terus salam,the campaign model is like this precisely because the sound comes down
orang orang terlalu sibuk dukung ganjar dukung ahok cuma diam,People are too busy supporting Ganjar to support Ahok just silent
ganjar ikut bawa asa mahfud memang the real deal tanggap masuk rakyat ganjar pranowo dia betul rakyat akan buat lebih rakyat renkul ganjarmahfud ganjarpresidenrakyat coblos,Ganjar joined the hope of Mahfud indeed The Real Deal Response Entering the people of Ganjar Pranowo he was right the people would make more people Renkul Ganjarmahfud GanjarPresidenrakyat voted
komitmen ganjar mahfud wujud ubah positif semarang motivasi masyarakat dukung ganjar pranowo kamu hak dapat baik ganjarmahfud dulujokowisekarangganjar coblos,Commitment to Ganjar Mahfud Figure Positive Change Semarang Community Motivation Supports Ganjar Pranowo You Right to Be Good Ganjarmahfud Dulujokowowisangganjar Publos
alhamdulillah pimpin pondok pesantren alhasan ciamis kh syarif hidayatullah tiba jis dini hari tadi gabung masa lain meski putra calon anggota legislatif ppp usung ganjar ayah konsisten ubah kumpulakbarjis,"Alhamdulillah, the Lead of the Alhasan Islamic Boarding School Ciamis KH Syarif Hidayatullah arrived at the early morning this morning joined another time even though the son of the candidate for the legislative candidate of the PPP Usung Ganjar was consistently changed the Kumpulbarjis"
enggak usah bawa bawa agama salah perintah blok goblok memang umat islam minta pilih umum bareng sama rabu abu buzzerp ganjar memang sebal ajar kemarin elektabilitasnya anjlok gara gara buzzernya goblok,"You don't need to bring a religion, the wrong order of the Goblok Block is that Muslims ask to vote for public together with Wednesday, Abu Buzzerp Ganjar is indeed annoyed in teaching yesterday the electability has plummeted because the buzzer is stupid"
kasihan lihat pak ganjar pak anda bapak bukan partai demokrasi indonesia coblos bapak,"sorry to see Mr. Ganjar, sir, you are not the Democratic Party of Indonesia, you voted"
pilih ganjar mahfud cara cegah buruk kuasa,Choose Ganjar Mahfud how to prevent bad power
punya foto jaket bomber ganjarmahfud lah,have a photo of a ganjarmahfud bomber jacket
ganjar mahfud duo paham arti benar adil sosial ganjar pranowo dia betul rakyat akan buat lebih rakyat ganjarmahfud ganjarpresidenrakyat coblos,Ganjar Mahfud Duo Understanding the true meaning of Social Fair Ganjar Pranowo he is right the people will make the people of Ganjarmahfud Ganjarpresidenrakyat votes
prestasi luar biasa ganjar pranowo gubernur lihat capai bangun juga cermin tinggi integritas perintah provinsi jawa tengah spi ganjar pranowo hanya ganjarmahfud ganjarpresidenrakyat kratonbersamarakyat,Ganjar Pranowo Governor's extraordinary achievement seeing the tired of Bangun as well as a high mirror of integrity in Central Java Province SPI Ganjar Pranowo is only Ganjarmahfud Ganjarpresidenakyat KratonBersamarakyat
nganuang ganjar,Ganjar
ada ganjarmahfud panggung politik cermin semangat satu agam sejahtera kali lipat indonesia hebat oshushu ganjarmahfud dulujokowisekarangganjar coblos,there is a ganjarmahfud political stage
pak ganjar pak be like,"Mr. Ganjar, Mr. Be Like"
kue ulang tahun ganjar mahfud,Ganjar Mahfud's birthday cake
mas ganjar kayak pahlawan didik gubernur ajar jadi inspirasi buat anakanak muda tiga kali lebih sejahtera indonesia hebat  ganjarmahfud salammtal coblos,Mas Ganjar like the hero of Didik Governor teaching so an inspiration for young children three times more prosperous Indonesia Ganjarmahfud Salammtal Coblos
waktu jokowi ya,Jokowi's time
program desa faskes nakes jadi langkah buat ganjarmahfud bawa ksehatan rata ganjar pranowo kamu hak dapat baik ganjarmahfud dulujokowisekarangganjar coblos,Program Village Faskes Nakes is a step for Ganjar Mahfud to bring Ganjar Pranowo's flat health.
libat seniman beri warna baru jalan politik ganjarmahfud ganjar pranowo bukti sejahtera scaramouche ganjarmahfud salammtal coblos,Libat artists give a new color of the political way of Ganjarmahfud Ganjar Pranowo Evidence of Prosperous ScaramoucheChe Ganjarmahfud Salammtal votes
indo tetap gas pol pak ganjar,Indo Permanent Gas Pol Pak Ganjar
kunjung ganjar pasti dapat aspirasi bagai kalang dengar tunjuk prinsip demokrasi sejati ganjar pranowo dia betul rakyat akan buat lebih rakyat ganjarmahfud dulujokowisekarangganjar coblos,"Ganjar visited the aspiration as if he heard the principle of true democracy, Ganjar Pranowo, he was right for the people to make the people of Ganjarmahfud DulujokowiSangganjar Coblos"
hari akhir kampanye ganjarmahfud jadwal orasi simpanglima semarang ganjarmahfud ganjarpranowo gerakcepat mahfudmd indonesiaunggul indonesialebihbaik ganjarmahfud ganjarmahfudmnang,The final day of the Ganjar Mahfud campaign Schedule of Simpang Lima Semarang Ganjar Mahfud Ganjar Pranowo Movement Magic Mahfudmd Indonesia Indonesia is better
debat calon presiden jadi momen emas ganjar tunjuk komitmen didik sehat ganjar pranowo bukti sejahtera ganjarmahfud ganjarpresidenrakyat coblos,The debate of the presidential candidate became the gold moment of Ganjar to show the commitment of Didik Sehat Ganjar Pranowo Evidence of Prosperous Ganjarmahfud GanjarPresidenrakyat voted
indeks integritas perintah provinsi jawa tengah capai jadi bukti nyata hasil ganjar pranowo bangun tata kelola perintah transparan ganjar pranowo yang baik rakyat ganjarmahfud ganjarpresidenrakyat kratonbersamarakyat,The Integrity Index of the Central Java Provincial Order Integrity is a clear proof of the results of the Ganjar Pranowo Building Governance Governance Ganjar Pranowo who is good people Ganjarmahfud GanjarPresidat KratonBersamarakyat
golput saja janji doang prabs culik ganjar soal wadas baik terus lini masa jadi sering lewat soal politik aku temu thread desak beberapa cuplik video sana ada kata memang bisa sama dari tiga pasang calon cari,"just abstentions just promise Prabs Ganjar about the good wadas and the time line is often through political issue I meet the thread of some cuplik video there, there can be the same word from three pairs of candidates looking for"
pak ganjar pak mahfud sosok milik solusi cerdas atas tantang ekonomi hadap masyarakat sama ganjar sejahtera ganjarmahfud dulujokowisekarangganjar coblos,"Pak Ganjar Pak Mahfud, a figure belonging to an intelligent solution to the economy to the community with Ganjar Sejahtera Ganjarmahfud DulujokowiSangganjar, voted"
prabowo bakti juang buat bangsa negara zaman ganjar jadibisa apao baru rambat rangkak yasedangkan sama ganjar paling baru jadi embrio kan,"Prabowo Bakti Fighting for the Nation of the Ganjar era so that it can be any new propagation, but the same as the most recent Ganjar, is the embryo"
pak ganjar ukir prestasi calon presiden paling peduli layan sehat rakyat tiap debat ganjar pranowo bukti sejahtera  ganjarmahfud dulujokowisekarangganjar coblos,Pak Ganjar Ukir Achievement Achievement of the most concerned Presidential Candidates for the People's Healthy Services Every Ganjar Pranowo Debate Prosperous Ganjarmahfud DulujokowowiSangganjar Coblos
rakyat percaya ganjarmahfud pimpin dekat rakyat bukan lama kampanye ganjar pranowo dia betul rakyat akan buat lebih rakyat  ganjarmahfud ganjarpresidenrakyat coblos,The people believe that Ganjarmahfud is a close leader of the people not long ago the Ganjar Pranowo campaign he is really the people will make the people of Ganjarmahfud Ganjarpresidenakyat Coblos
ganjar finobatkan gubernur baik se indonesia tahun prestasi gemilang bukti prestasi banyak amp integritas,Ganjar Finished Governor Both in Indonesia Year Achievement Evidence of Achievement Many AMP Integrity
tuju sih kalau program pak ganjar keren keren banget ganjarmahfud ganjarpresidenrakyat gaspol,"aim if the program Mr. Ganjar is really cool, Ganjarmahfud Ganjarpresidenrakyat Gaspol"
alam ganjar lihat famili man sekali,Alam Ganjar See Family Man once
ganjar pranowo presiden rakyatt bukan figur populer pimpin mampu pimpin bijaksana ganjar pranowo dia betul rakyat akan buat lebih rakyat ganjarmahfud ganjarpresidenrakyat coblos,"Ganjar Pranowo The people of the people are not the popular figures leading to be able to be wise leader Ganjar Pranowo, he is really the people will make the people of Ganjarmahfud Ganjarpresidenakyat votes"
ganjar bimbing untuk sadar pndidikan tonggak bangkit bangsa ganjar pranowo dia betul rakyat akan buat lebih rakyat ganjarmahfud salammtal coblos,"Ganjar Budik to realize the education of the milestone of the rise of the nation of Ganjar Pranowo, he is really the people will make the people of Ganjarmahfud Salammtal votes"
lalu sekolah tengah juru gratis pak ganjar buka lembar baru juang lawan kmiskinan indonesia ganjar pranowo bukti sejahtera ganjarmahfud ganjarpresidenrakyat coblos,Then the middle school of the free interpreter Mr. Ganjar opened the new sheet of fighting against the poverty of Indonesia Ganjar Pranowo Prosperous Prose
peduli pak ganjar sehat anakanak sinergi baik komitmen pak mahfud md cipta lingkung hukum adil ganjar pranowo dia betul rakyat akan buat lebih rakyat ganjarmahfud dulujokowisekarangganjar coblos,"Caring Pak Ganjar Healthy Children Sineeri Good Commitment Pak Mahfud MD Cipta LEGAL LEGAL FAIR GANGRA GANGRANO PRANOWO, he is really the people will make more people Ganjarmahfud DulujokowiSangganjar Coblos"
konser salam mtal jadi momentum raya sama harap sama bawah pimpin ganjar mahfud ganjar pranowo dia betul rakyat akan buat lebih rakyat ganjarmahfud dulujokowisekarangganjar coblos,"The Salam Mtal concert is the same momentum, hopefully the same as leading Ganjar Mahfud Ganjar Pranowo, he is really the people will make the people of Ganjarmahfud DulujokowiSangganjar Coblos"
suarasuara dukung semarang alir deras ganjar mahfud ganjar pranowo bukti sejahtera ganjarmahfud dulujokowisekarangganjar coblos,"Suarasuara Supports Semarang, Ganjar Mahfud, Ganjar Pranowo, Prosperous Prosperous Ganjarmahfud DulujokowiSangganjar Coblos"
pak ganjar prof mahfud tegas hasil suatu bangsa tak pisah kontribusi perempuan kuat ganjar pranowo bukti sejahtera go ganjarmahfud ganjarpresidenrakyat coblos,Pak Ganjar Prof. Mahfud is firm
ikn nusantara bangun bukan cuma pindah ibu kota negara tapi bangun ikn nusantara cipta budata baru cerdas lanjut kreatif bu smi fahri onana maling ugm deh gea ganjar pranowo,"Ikn Nusantara Bangun not only moved the capital city of the country, but I woke up Ikn Nusantara Cipta Budata Baru Smart Continue Creative Mrs. SMI Fahri Onana Maling UGM deh Gea Ganjar Pranowo"
dukung masyarakat jawa barat ganjarmahfud rupa bentuk percaya pimpin komitmen nilai moral etika ganda sejahtera raih makmur lanjut ganjarmahfud ganjarpresidenrakyat coblos,"Supports the people of West Java, Ganjarmahfud Forms of Believe in the Commitment of Moral Value of Moan Ethics, Prosperous Makmur, Ganjarmahfud Ganjarpresidenrakyat Coblos"
masyarakat jawa barat ganjarmahfud jadi harap cerah ksehatan ganjar pranowo yang baik rakyat twt ganjarmahfud dulujokowisekarangganjar coblos,"West Java community Ganjarmahfud will be brightly health, Ganjar Pranowo is a good people of TWT Ganjarmahfud DulujokowowiSangganjar Boy"
ganjar cerdas rancang rencana aksi konkret atas tantang pndidikan indonesia ganjar pranowo bukti sejahtera ganjarmahfud salammtal coblos,Ganjar Smart Designing a concrete action plan for Indonesian education Ganjar Pranowo Evidence Prosperous Ganjarmahfud Salammtal Coblos
ganjar mahfud bukan pasang calon juga pionir ubah jadi internet butuh dasar ganjar pranowo bukti sejahtera ganjarmahfud dulujokowisekarangganjar coblos,Ganjar Mahfud is not a pair of candidates also pioneers changed to the internet need a basis for ganjar pranowo proof of prosperous ganjarmahfud dulujokowisangganjar voting
 jadi menang satu putar nih ganjar wkwk,so win one turn with this Ganjar wkwk
komitmen maju perempuan indonesia pasang calon presiden wakil presiden nomor urut ganjar pranowomahfud md komitmen maju perempuan indonesia pasang calon presiden wakil presiden ganjar pranowomohammad mahfud,Commitment to Forward Indonesian Women Install Presidential Candidate Vice President Candidate Number Ganjar Pranowomahfud MD Commitment to advance Indonesian Women Install Presidential Candidate Vice President Ganjar Pranowomohammad Mahfud
ganjarmahfud ajar politik jadi panggung suara indah ganjar pranowo yang baik rakyat ganjarmahfud salammtal coblos,"Ganjarmahfud Teaching Politics became the stage of the beautiful voice of Ganjar Pranowo, the good people of Ganjarmahfud Salammtal voted"
rangkul bagai elemen masyarakat ganjarmahfud cipta dekat buat makin percaya dekat agam pluralitas ganjar pranowo hanya dia yang betul rakyat ganjarmahfud ganjarpresidenrakyat coblos,Embrace like an element of the community Ganjarmahfud Cipta is close to more trusting near Agam Plurality Ganjar Pranowo Only He is the Right of the People of Ganjarmahfud Ganjarpresidenakyat Coblos
pilih fighter baik kamu mana lebih juang butuh masa depan rakyat ganjar prabowo,Choose your good fighter where more fighting needs the future of the people of Ganjar Prabowo
sakitna tak berapa maluna patuh saran ganjar henti selaku menteri,It was not what Maluna obeyed the suggestion for Ganti to the Minister
pak ahok rela mundur abdi bangsa negara ganjarmahfud partai lambang banteng integritas gue lebih tuju pak mahfud dia calon wakil presiden harus sejak kontrak politik teken mundur drama politik telanjang,"Pak Ahok is willing to resign the abdi nation of Ganjarmahfud, the party symbol symbol of my integrity is more aimed at Mr. Mahfud, he is a vice -presidential candidate since the political contract has to withdraw the naked political drama"
benar calon presiden pak ganjar bjil,true presidential candidate Mr. Ganjar Bjil
sukses konser salam mtal bukti ganjar mahfud milik daya tarik kekharismaan kuat mata masyarakat ganjar pranowo yang baik rakyat yii ganjarmahfud dulujokowisekarangganjar coblos,"Success of the Salam Mtal Concert Evidence of Ganjar Mahfud belongs to the power of the power of the strong eyes of the Ganjar Pranowo community, the people of YII Ganjarmahfud DulujokowowiSangganjar Coblos"
ganjar pranowo prof mahfudbikin semangat politik makin tinggi kampanye keren habis dukung terus sat set tas tes jadi solusi rakyat ganjar pranowo yang baik rakyat ganjarmahfud ganjarpresidenrakyat coblos,"Ganjar Pranowo Prof. Mahfudbikan Political Spirit The higher the cool campaign after continuing to support the test of the test bag so the good solution of the people of Ganjar Pranowo, the people of Ganjarmahfud GanjarPresidenrakyat Coblos"
rasa optimis terus tumbuh kalang masyarakat jawa tengah atas komitmen ganjar mahfud cipta sejahtera ganjar pranowo kamu hak dapat baik ganjarmahfud dulujokowisekarangganjar coblos,"A sense of optimism continues to grow the people of Central Java for the commitment of Ganjar Mahfud Cipta Sejahtera Ganjar Pranowo, you are the right to be good"
kata tindak ganjarmahfud jadi cermin ingin masyarakat jawa timur ganjar pranowo dia betul rakyat akan buat lebih rakyat ganjarmahfud ganjarpresidenrakyat coblos,"said Ganjarmahfud acts to be a mirror want the people of East Java Ganjar Pranowo, he is really the people will make more people Ganjarmahfud Ganjarpresidenakyat votes"
kalau ganjar lolos putar auto jadi ba freshcare kayak wkwk,"If Ganjar escapes Auto, so Ba Freshcare is like wkwk"
masyarakat jawa barat sepakat kini waktu bersamasama gaung salam metal menang ganjar mahfud pilih presiden sama ganjar sejahtera ganjarmahfud dulujokowisekarangganjar coblos,The people of West Java agreed that now the time together with Gaung Salam Metal Winning Ganjar Mahfud Choose the President and Ganjar Sejahtera Ganjarmahfud DulujokowowiSangganjar Boblos
o blunder terus habis habis kemarin calon wakil presiden sekarang timsuksesnya pak butet pak guntur sampean kerasukann apa astagfiruallah kasihan sama pak ganjar though sampean sampean,o The blunder continues to run out yesterday the vice presidential candidate is now the success of Mr. Butet Mr. Guntur sampean is possessed what Astagfiruallah is sorry for Mr. Ganjar Though sampean
semua hakim jawa tengah deklarasi pilih wilayah kuasa presiden ganjar kalau manusia sehat ada kata lambat,All Central Java Judges Declaration Choose the Power of Attorney of the President Ganjar if there is a healthy human
kalau lingkar orangorang pilih ke putar dua antipdip dulu kan mereka memang pilih kalau lolos dukung ganjar mungkin lebih antijkw sih entah ruwet,"If the circumference of people choose to the second round of anti -PDIP first and they do choose if they pass supporting Ganjar, it might be more antijkw, I don't know if it's complicated"
ganjar pimpin tidak bicara tindak ksehatan sama ganjar sejahtera ganjarmahfud ganjarpresidenrakyat kratonbersamarakyat,"Ganjar, Lead not talking about health actions with Ganjar Sejahtera Ganjar Mahfud GanjarPresidat KratonBersamarakyat"
jadi presiden sudah ini kasihan para tokoh dorong sama awal prabowo,So the president is sorry for pushing figures with the beginning of Prabowo
sapa kawan dunia maya ganjar presiden ahok cocok jabat apa tulis komen,Greet a virtual world friend Ganjar President Ahok is suitable for the jabat to write a comment
ku tak jauuuhjauuuh mu bisa pindah on acara konser metal gelora bung karno kemarin menyalaaa ganjar mahfud menang total ganjarmahfud,"I don't know you can move on the Bung Karno Metal Concert event yesterday, Ganjar Mahfud won a total of Ganjarmahfud"
ganjarmahfud bikin ksehatan jadi giat asyik bikin bosan sama ganjar sejahtera ganjarmahfud dulujokowisekarangganjar coblos,Ganjar Mahfud makes health and is active in making bored with Ganjar Sejahtera Ganjarmahfud DulujokowiSangganjar voting
pak ganjar scorpio,Mr. Ganjar Scorpio
bersih taint korupsi ganjar pranowo pilih bawa angin segar peta politik indonesia ganjar pranowo dia betul rakyat akan buat lebih rakyat ganjarmahfud ganjarpresidenrakyat coblos,Clean Taint Corruption Ganjar Pranowo Choose a fresh air Map of Indonesia Ganjar Pranowo He is really the people will make the people of Ganjarmahfud Ganjarpresidenakyat votes
anak muda semangat nanti lapang kerja program ganjarmahfud sejahtera kali lipat indonesia hebat ganjarmahfud ganjarpresidenrakyat coblos,Young people are enthusiastic later the work of the Ganjarmahfud Program Prosperous Program Kali Folding Indonesia Great Ganjarmahfud Ganjarpresidenakyat Coblos
tag dress korean gaya outfit of the day outfit toko oren shopee belanja checkout co spill link zona jajan zona uang zona ba freelance alam mahasiswa februari coklat abe sakura golput ganjar cantik fashion,Tag Dress Korean Outfit Style of the Day Outfit Oren Shopee Shop Shopping Checkout Co Spill Link Zone Zone Zone BA Freelance Natural Students February Chocolate Abe Sakura Golput Ganjar Beautiful Fashion
megawati murka dukung ganjarmahfud intimidasi takut kalah,Megawati is angry to support Ganjarmahfud Intimidation is afraid of losing
usaha anak nanti punya ayah kayak pak pak ganjar,Children's efforts will have a father like Mr. Ganjar
wow kamu tim ganjar mamihh,"Wow, you are the Ganjar Mamihh team"
indo pak ganjar memang orang baik,Indo Pak Ganjar is indeed a good person
yang gaung salam alias gabung pak ahok bilang koalisi ganjar itu tidak mungkin jadi,"the echo of greetings, aka joining Mr. Ahok, said that the Ganjar coalition was impossible"
ganjarmahfud jadi harap baru buat sehat sukses mas ganjar jawa tengah ngebuat yakin bisa bawa ubah positif ganjar pranowo yang baik rakyat ganjarpresidenrakyat ganjarmahfud coblos,"Ganjar Mahfud is a new hope for healthy successful, Mas Ganjar, Central Java, made sure he could bring positive changes in Ganjar Pranowo, the good people of GanjarPresidat Ganjarmahfud Coblos"
kepmimpinan mas ganjar bukti efektif dekat langsung masyarakat jadi kunci sukses tiga kali lebih sejahtera indonesia jaya ganjarmahfud dulujokowisekarangganjar coblos,The leadership of Mas Ganjar Effective Evidence can be directly the community to be the key to success three times more prosperous Indonesia Jaya Ganjarmahfud DulujokowiSangganjar Coblos
kalau kerja pak ganjar sih perlu ragu,"If you work, Mr. Ganjar, you need to hesitate"
tren top of mind terus kuat ganjar stagnan,The Top of Mind trend continues to be strong Ganjar stagnant
ganjar beri contoh integritas nilai harus junjung tinggi tiap langkah ganjar pranowo dia betul rakyat akan buat lebih rakyat davala ganjarmahfud salammtal coblos,Ganjar give an example of the integrity of the value must uphold each step of Ganjar Pranowo he is right the people will make the people of Davala Ganjarmahfud Salammtal votes
rakyat yakin ganjar pimpin akan bawa ubah positif lalu kebijakankebijakan rakyat sama ganjar sejahtera ganjarmahfud dulujokowisekarangganjar coblos,The people are sure that Ganjar will lead to a positive change and then the policies of the people's policy are the same as Ganjar Sejahtera Ganjarmahfud DulujokowiSangganjar Boblos
pak ganjar custom jaket,Mr. Ganjar Custom Jacket
