full_text,tweet_english
tanggung curang sekali jadi kalau kalah play victim sekali juang coblos surat suara guna program keluarga harap buat nekan nanti tinggal ketua komisi pemelihan umum salah beres aragon ada ganjar rocky gerung,"very cheating so if you lose play Victim once a ballot voting for the family program, please make a rush later, only the Chairperson of the General Pemulahan Commission is wrong, Aragon, there is Ganjar Rocky Gerung"
bangga banget punya calon presiden ganjar tidak pernah lupa sama didik anakanak jawa tengah ganjar pranowo bukti lebih baik ozz ganjarmahfud salammtal coblos,Very proud to have a presidential candidate Ganjar never forgot the Didik Children of Central Java Ganjar Pranowo Evidence is better OZZ Ganjarmahfud Salammtal votes
warga jawa barat yakin bawah panji salam metal ganjar mahfud bawa sejahtera mereka ganjar pranowo bukti lebih baik ganjarmahfud dulujokowisekarangganjar coblos,West Java citizens believe that under the banner of Ganjar Metal Metal Mahfud Bawa Prosperous Ganjar Pranowo Evidence is better Ganjarmahfud DulujokowiSangganjar Publos
hadir pak ganjar prof mahfud semarang beri semangat baru warga turut bangun negeri ganjar pranowo bukti sejahtera  ganjarmahfud dulujokowisekarangganjar coblos,Present Pak Ganjar Prof. Mahfud Semarang gave a new spirit of residents to build the country of Ganjar Pranowo Prosperous Prosperous Ganjarmahfud DulujokowiSangganjar Coblos
ganjarmahfud lihat peduli dalam tara akses didik lalu bijak internet gratis sekolah ganjar pranowo dia betul rakyat akan buat lebih rakyat ganjarmahfud dulujokowisekarangganjar coblos,Ganjar Mahfud See Caring in Didik Access then Wisely Wise Internet Ganjar Pranowo School He is really the people will make more people Ganjarmahfud DulujokowiSangganjar Plot
panitia kalah,The committee lost
dukung ganjar pranowo caprs cawaprs kberanian prof sumber integritas bersih sendiri sama ganjar sejahtera ganjarmahfud ganjarpresidenrakyat coblos,Support Ganjar Pranowo Caprs Cawaprs Kberady Prof. Sumber Sumber Integrity itself is the same as Ganjar Sejahtera Ganjarmahfud Ganjarpresidenakyat votes
program desa faskes nakes bikin yakin ganjarmahfud punya rencana ksehatan matang ganjar pranowo dia betul rakyat akan buat lebih rakyat ganjarmahfud dulujokowisekarangganjar coblos,"The Village Faskes Program, Nakes, makes sure that Ganjar Mahfud has a mature health plan for Ganjar Pranowo, he is really the people will make more people Ganjarmahfud DulujokowiSangganjar Coblos"
selamat ulang tahun pak ganjar,"Happy birthday, Mr. Ganjar"
ganjar calon presiden inspiratif mampu saji program rakyat konkret entas miskin sama ganjar sejahtera ganjarmahfud dulujokowisekarangganjar coblos,"Ganjar, Inspirational Presidential Candidate is able to serve the Konkret Poor People's Program and Ganjar Sejahtera Ganjarmahfud DulujokowiSangganjar Boblos"
ganjar mahfud ahok tiga rangka indonesia maju,Ganjar Mahfud Ahok Tiga Indonesia Framework Maju
ajar agama penting guys,teach important religion guys
pesan akhir seniman blacius subono ganjar mahfud tuan rakyat setinggi apa jabat hanya mandat selamat pagi sahabat gasssganjarmahfud,Final Message of Artist Blacius Subono Ganjar Mahfud Tuan Rakyat as high as the jabat is only a good morning mandate friend of Gasssganjarmahfud
bocah cilik cerdaskemarin yang demo pak jokowi kunjung k daerah cerdas pak pilih pak ganjar sekarang balik sama bocah cilik cerdas,"The Smart Little Boy Yesterday, the Demo of Pak Jokowi visited to the smart area, Mr. Ganjar, now back with the smart little boy"
yuk barengbareng dukung ganjarmahfud program desa faskes nakes jadi nyata ksehatan masyarakat jamin ganjar pranowo bukti sejahtera ganjarmahfud dulujokowisekarangganjar coblos,"Come together to support the Ganjarmahfud Village Faskes Program, the Health Faculty of Health, it becomes real in the community, guarantee that the Ganjar Pranowo Prosperous Evidence of Ganjarmahfud Dulujokowowisangganjar is voting"
basa basi bakso,Meatballs
ganjarmahfud paham banget penting ksehatan masyarakat jadi makin peduli ganjar pranowo kamu hak dapat baik ganjarmahfud dulujokowisekarangganjar coblos,Ganjar Mahfud really understands important public health so more care about Ganjar Pranowo you are right to be good ganjarmahfud dulujokowisangganjar voting
sikap kritis ganjar konflik penting jadi bukti nyata ia komitmen berantas curang sejahtera lipat ganda indonesia makmur sentosa ganjarmahfud ganjarpresidenrakyat coblos,"The critical attitude of Ganjar is an important conflict, so it is a clear proof that he is committed to the eradication of the Indonesian double -prosperous cheating, Makmur Sentosa Ganjarmahfud Ganjarpresidenrakyat votes"
tak terima sebut jenderal menclamencle luhut balas ganjar menclamencle dia,Not accepted to be called General Menggla Menlel Luhut Reply Ganjar Menjla Melle him
harap perintah inklusif akomodasi agam bangsa makin kuat hadir ganjarmahfud ganjar pranowo kamu hak dapat baik ganjarmahfud ganjarpresidenrakyat coblos,hope that the inclusive order of religious accommodation of the nation is getting stronger present Ganjarmahfud Ganjar Pranowo you right can be good
inap rumah warga ganjar bukti komitmen nyata hidup sama rasa hidup seharihari rakyat ganjar pranowo bukti sejahtera ir ganjarmahfud ganjarpresidenrakyat coblos,Inpatient Houses of Ganjar Residents Evidence of real commitment to live the same sense of daily life Ganjar Pranowo Evidence of Prosperous Ir Ganjarmahfud GanjarPresidenakyat Coblos
konser salam mtal sukses bikin semua merinding makin mantap dukung ganjarmahfud ganjar pranowo dia betul rakyat akan buat lebih rakyat agustina ganjarmahfud ganjarpresidenrakyat coblos,The Salam Mtal Concert Successfully made all goosebumps more solid Support Ganjarmahfud Ganjar Pranowo He really will make the people of Agustina Ganjarmahfud GanjarPresidenrakyat Coblos
lalu kampanye akbar pak ganjarprof mahfud hasil rangkul hati masyarakat solo cipta ikat emosional kuat ganjar pranowo kamu hak dapat baik  ganjarmahfud dulujokowisekarangganjar coblos,Then the grand campaign of Mr. Ganjarprof Mahfud results from the heart of the people of Solo Cipta Cipta Tempik Strong Ganjar Pranowo You Right to be good Ganjarmahfud DulujokowiSangganjar Coblos
ganjar mahfud hadir solusi realistis dampak langsung hidup seharihari masyarakat ganjar pranowo yang baik rakyat ganjarmahfud dulujokowisekarangganjar coblos,Ganjar Mahfud is present a realistic solution to the direct impact of daily life of the Ganjar Pranowo community who is good for the people of Ganjarmahfud DulujokowiSangganjar votes
responsif butuh rakyat mas ganjar prof mahfud pasang paham dalam masalah bangsa ganjar pranowo bukti sejahtera ganjarmahfud dulujokowisekarangganjar coblos,Responsive Needs the people of Mas Ganjar Prof. Mahfud Installing Understanding in the Problem of the Nation Ganjar Pranowo Prosperous Evidence of Ganjarmahfud DulujokowiSangganjar Publos
pak ganjar pak mahfud jadi harap baru laku usaha kecil tengah janji untuk sedia internet jangkau sama ganjar sejahtera ganjarmahfud dulujokowisekarangganjar coblos,Pak Ganjar Pak Mahfud so hopefully just a small business in the middle of an appointment to be ready to reach the internet with Ganjar Sejahtera Ganjarmahfud DulujokowiSangganjar Boblos
kotakota pintar indonesia terus kembang pesat dukung ganjarmahfud ganjar pranowo bukti sejahtera nu ganjarmahfud ganjarpresidenrakyat coblos,Indonesian Smart City City continues to support the rapidly supporting Ganjar Mahfud Ganjar Pranowo Evidence of NU Prosperous NU Ganjarmahfud Ganjarpresidenrakyat votes
kampus eks pimpin komisi berantas korupsi dengan ramai ingat jokowi soal standar etika moral sama rakyat tolakpasloncacatetika kita satu sama tegak adil sama ganjar mahfud ganjarmahfud,The former campus leads the Corruption Eradication Commission with a busy remembering Jokowi about the Moral Ethics Standards with the people to reject our Pasloncacatatatik one equal to Ganjar Mahfud Ganjarmahfud
rakyat gerak ganjarmahfud katalis ubah positif ganjar pranowo kamu hak dapat baik ganjarmahfud ganjarpresidenrakyat coblos,the people of the Ganjarmahfud Catalyst Motion Change positive Ganjar Pranowo You Right to be Good Ganjarmahfud Ganjarpresidenakyat Coblos
ganjar pranowo tekan indonesia maju visi sama harus wujud ganjarpedulikesetaraan,Ganjar Pranowo Pressing Indonesia Forward Vision Must be a form of GanjarPeduliketarat
pranowo gas keun terus bro,pranowo gas keunan continues bro
gaspol ganjar mahfud,Gaspol Ganjar Mahfud
ganjarmahfud lanjut tongkat estafet pimpin jokowi bawa semangat ubah tak bendung tiga kali lebih sejahtera indonesia hebat ganjarmahfud ganjarpresidenrakyat coblos,Ganjarmahfud continued baton.
ganjar inspirasi generasi muda tunjuk pimpin sejati mulai hati peduli ganjar pranowo kamu hak dapat baik ganjarpresidenrakyat ganjarmahfud coblos,Ganjar Inspiration Young Generation Appoint a True Lead Starting to Care for Ganjar Pranowo You Right to Be Good GanjarPresidenrakyat Ganjarmahfud Coblos
sarap pagi pakai nasi berkat ganjar kirim orang,Save morning using rice thanks to Ganjar Sending People
pimpin perempuan hanya anggap objek layan bagai agen ubah lanjut lingkung ganjar pranowo bukti sejahtera ganjarmahfud salammtal coblos,Lead women only consider servants as agents to change further Lingkung Ganjar Pranowo Evidence of Prosperous Ganjarmahfud Salammtal Coblos
bela ganjar ahok rela jelek jelek jokowi gibran bisa kerja manusia munafik,Bela Ganjar Ahok is willing to be ugly Jokowi Gibran can work hypocritically
iya lah batal maju otomatis ganjar jadi presiden pilih langsung pindah semuaa,"Yes, it is canceled Automatically Ganjar so the president chooses to move directly"
program ganjar jelas angkat miskin angkat harkat martabat keluarga miskin bangsa program culik anak haram mk makan gerat membodohksn rakyat jadi malas tetap jadi gembel emis selalu harap tepat jatuh pilih,The Ganjar Program clearly adopts the poor lift the dignity of the poor family of the nation's kidnapped program for illegitimate children to eat gest fools the people so lazy to remain so gembel emis
yang bilang ganjar mirip gojo,who said Ganjar resembles Gojo
ganjar pranowoprof mahfud bikin kartu tanda duduk sakti bikin data masyarakat lebih atur ganjar pranowo dia betul rakyat akan buat lebih rakyat ganjarmahfud dulujokowisekarangganjar coblos,Ganjar Pranowoprof Mahfud made a Sakti Sitting Identity Card Making Community Data Set Ganjar Pranowo He really will make more people Ganjarmahfud DulujokowiSangganjar Coblos
pimpin ganjar yakin dunia pndidikan boleh pinggir agenda bangun ganjar pranowo yang baik rakyat ganjarmahfud salammtal coblos,Lead Ganjar believes that the world of education may be the edge of the agenda to build a good Ganjar Pranowo people Ganjarmahfud Salammtal Coblos
dukung ganjar pranowo pasang milik tekad kuat bersih birokrasi pulih percaya publik sama ganjar sejahtera ganjarmahfud ganjarpresidenrakyat coblos,Support Ganjar Pranowo Installing Strong Determination Bureaucracy Recovered Believe in the Public with Ganjar Sejahtera Ganjarmahfud Ganjarpresidenakyat votes
ganjarmahfud tawar solusi bukan teoritis juga praktis dampak langsung ganjar pranowo yang baik rakyat ganjarmahfud dulujokowisekarangganjar coblos,Ganjarmahfud Tawar Solution Non -Theoretical Solution is also practical direct impact of Ganjar Pranowo who is good people Ganjarmahfud DulujokowiSangganjar voting
internet gratis sekolah rupa langkah maju signifikan ganjarmahfud indonesia ganjar pranowo kamu hak dapat baik ganjarmahfud dulujokowisekarangganjar coblos,Free Internet Fine School Step Significant Significant Ganjarmahfud Indonesia Ganjar Pranowo You Right to Be Good Ganjarmahfud DulujokowiSangganjar Boblos
tau kenapa eropa paling banyak pilih ganjar sama karena sana sedikit orang goblok,know why Europe the most chooses Ganjar is the same because there are a few people who are stupid
saksi hidup hdir hingga acara selesai pak ganjar tiba gelora bung karno lambat temn banyak terpks pulang jam sewa bis terbats macet pol bis susah gerak puas ikut hdir hingga selesai trjebak mcet brjam konsersalammtal ganjarmahfud yakinmenang,"Hdir's living witness until the event was finished, Mr. Ganjar arrived at the Bung Karno Gelora Slowly Temn Many Top Returns to Rent a Bus Rental, the Bis Jam Difficult to Move Satisfied with the HDIR until the trjak mcet was ganjarmtal ganjarmahfud sure"
ganjarmahfud buka peluang anakanak indonesia gapai impi ganjar pranowo bukti lebih baik  ganjarmahfud dulujokowisekarangganjar coblos,Ganjar Mahfud opens the opportunity for Indonesian children to reach the dream of Ganjar Pranowo Evidence is better Ganjarmahfud DulujokowiSangganjar Boblos
ganjar mahfud md caprs cawaprs hasil cipta bijak kualitas ganjar pranowo bukti sejahtera ganjarmahfud dulujokowisekarangganjar coblos,Ganjar Mahfud MD Candidate Candidate Cipta Wise Wise Quality Ganjar Pranowo Evidence Prosperous Ganjarmahfud DulujokowiSangganjar Boblos
krjasama selatanselatan ganjar nih tau bagaimana jadi solusi buat negara maju ganjar pranowo bukti sejahtera ganjarpresidenrakyat ganjarmahfud coblos,South Southern Cooperation Ganjar knows how to be a solution for developed countries Ganjar Pranowo Evidence of Prosperous GanjarPresidenrakyat Ganjarmahfud Coblos
ganjar mahfud menangmenaangmenang merdeka,Ganjar Mahfud wins winning independent
pak ganjar,Mr. Ganjar
rutin tinggal rumah warga mas ganjar jadi dialog interaksi langsung rakyat fondasi utama bijak perintah sama ganjar sejahtera ganjarpresidenrakyat ganjarmahfud coblos,Routinely lives in the house of Mas Ganjar to be a dialogue for the direct interaction of the people of the main foundation of wisely to the same as Ganjar Sejaranra GanjarPresidat Ganjarmahfud Coblos
ganjar contoh nyata kampanye bukan sekadar seremoni jakarta juga sentuh hati rakyat banda neira ganjar pranowo dia betul rakyat akan buat lebih rakyat ganjarmahfud dulujokowisekarangganjar coblos,"Ganjar, a concrete example of the campaign is not just a ceremony of Jakarta, also touch the hearts of the people of Banda Neira Ganjar Pranowo, he is really the people will make the people of Ganjarmahfud DulujokowiSangganjar Coblos"
ganjar mahfud hasil bawa atmosfer penuh semangat hajat rakyat di kota semarang sama ganjar sejahtera ganjarmahfud dulujokowisekarangganjar coblos,"Ganjar Mahfud, the result of carrying an atmosphere full of people's enthusiasm in the city of Semarang and Ganjar Sejahtera Ganjarmahfud DulujokowiSangganjar Publos"
gema lagu indonesia raya amp sholawatan gelora bung karno konser metal menang total ganjarmahpud menang menang menang,Echo of Indonesia Raya Songs Amp Sholawatan Gelora Bung Karno Metal Concert Wins Total Ganjarmahpud Wins Winning Winning
sangat sayang atas fenomena rakyat pukul oknum aparat bentang spanduk ganjar gunung kidul oknum sebut laku yang sama spanduk tulis gibran fan bentang bahkan malah sambut baik presiden sendiri,"It's a shame for the phenomenon of the people at the time of the landscape of the Ganjar Gunung Kidul banners, call the same behavior, Gibran Fan Bentang's banner even welcomed the President himself"
ganjar mahfud punya visi luar biasa fokus sejak kandung hindar stunting ganjar pranowo kamu hak dapat baik ganjarmahfud ganjarpresidenrakyat coblos,Ganjar Mahfud has an extraordinary vision of focusing since the hindar stunting ganjar pranowo you right can be good
tara genre terus sih juang ikut pak ganjar,Tara Genre Continue to Fighting in Pak Ganjar
ganjarmahfud juang konomi lebih inklusif sama ganjar sejahtera id ganjarmahfud dulujokowisekarangganjar coblos,Ganjarmahfud Juang Konomi is more inclusive with Ganjar Sejahtera Id Ganjarmahfud DulujokowiSangganjar Boblos
persetan elektabilitas ganjar,Ganjar's electability fuel
mas ganjar calon presiden erti sjarah ajak banda neira bangun masa depan sama ganjar pranowo dia betul rakyat akan buat lebih rakyat ganjarmahfud dulujokowisekarangganjar coblos,"Mas Ganjar, Presidential Candidate Erti Sjarah invites Banda Neira to build a future with Ganjar Pranowo, he is really the people will make the people of Ganjarmahfud DulujokowiSangganjar Coblos"
bentuk dukung ganjar mahfud tampil kece produk lokal kelas mas ganjar pak mahfud gerakcepatganjarmahfud satset pastilebihbaik satsetlebihbaik ganjarmahfud ganjarmahfudmnang salamjari ganjarpresidenrakyat mahfudpembelarakyat coblos,Form of Supporting Ganjar Mahfud Performing Local Product Class Mas Ganjar Pak Mahfud Motion Pastijarmahfud SATETS PASTIL EART SATETTE Both Ganjarmahfud Ganjarmahfudmnang Salamjari GanjarpresiKyat MahfudPembenakyat votes voting
mas ganjar pimpin tidak bicara tindak selesai masalah rakyat cepat efisien ganjar pranowo bukti sejahtera ganjarmahfud dulujokowisekarangganjar coblos,"Mas Ganjar, Lead not to talk about the action of the problem of the people quickly efficiently Ganjar Pranowo Evidence of Prosperous Ganjarmahfud DulujokowowiSangganjar Boblos"
closing nyata ganjar cold af,Real Closing Ganjar Cold AF
ganjar pranowo patut apresiasi hasil jadi jawa tengah provinsi risiko tindak korupsi rendah sesuai hasil pnilaian intgritas ganjar pranowo kamu hak dapat ganjarmahfud ganjarpresidenrakyat kratonbersamarakyat,Ganjar Pranowo deserves appreciation of the results of the Central Java Provincial Risk of Low Corruption Action in accordance with the results of the Ganjar Pranowo Integrity Assessment you are right to Ganjarmahfud GanjarpresiKyat KratonBersamarakyat
orang tidak suka gibran tidak usah pilih kamu gaperlu jelek jelek orang tidak suka ganjar tidak usah pilih saja repot pilih kan hak masing masing,"People don't like Gibran, don't choose you, bad bad people, people don't like Ganjar, don't just choose to choose their respective rights"
ganjarmahfud tunjuk teknologi didik dua dapat pisah ganjar pranowo kamu hak dapat yang baik ganjarmahfud dulujokowisekarangganjar coblos,Ganjarmahfud shows that the technology of students can be separated by Ganjar Pranowo.
bersih hati prof jadi cermin kberanian ganjar pranowo berantas praktikpraktik korupsi rugi negara ganjar pranowo bukti lebih baik ganjarmahfud ganjarpresidenrakyat coblos,Clean Heart Prof. Become a Mirror of Ganjar Pranowo Pranowo Corruption Practice State Loss Ganjar Pranowo Better Ganjarmahfud GanjarPresidenakyat Coblos
gue sepakat meski partai adil sejahtera situ jelas tentang omnibus law jadi better banding ganjar,I agreed that even though the Fair Prosperous Party there was clear about the Law Omnibus was a Better Appeal Ganjar
usai debat pamungkas janji ganjar pranowo mahfud md menang pilih presiden,"After the final debate, the promise of Ganjar Pranowo Mahfud MD won the president"
ganjar tegas tara akses pndidikan fondasi utama bangun masyarakat inklusif sejahtera kali lipat indonesia hebat ganjarmahfud salammtal coblos,Ganjar Tara Tara Access to Education Main Foundation Building Inclusive Prosperous Society Kali Folding Indonesia Great Ganjarmahfud Salammtal Coblos
aku putus buat tetap pilih pak ganjar mahfud,I broke up to keep choosing Mr. Ganjar Mahfud
ganjarmahfud calon presiden calon wakil presiden pilih hati peduli sama ksehatan ganjar pranowo bukti sejahtera ganjarmahfud dulujokowisekarangganjar coblos,Ganjarmahfud Candidate Candidate Vice President Candidates Choose Heart Caring for the Health of Ganjar Pranowo Evidence of Prosperous Ganjarmahfud DulujokowiSangganjar Boblos
ganjar pak ganjar juara debat calon presiden hasil yakin bahwa layan sehat akses semua kalang ganjar pranowo bukti sejahtera ganjarmahfud dulujokowisekarangganjar coblos,Ganjar Pak Ganjar Champion Debate of Presidential Candidates believes that healthy services access to all the chaotic ganjar pranowo proof of prosperous ganjarmahfud dulujokowowisangganjar voting
kiprah ganjar pranowoprof mahfud bidang ekonomi beri harap baru harga sembako murah semua kalang ganjar pranowoprof mahfud presiden rakyat ganjar pranowo dia betul rakyat akan buat lebih ganjarmahfud ganjarpresidenrakyat coblos,"Ganjar Pranowoprof's Gait Mahfud gives a new hope for cheap food prices for all the frantal of Ganjar Pranowoprof Mahfud, the President of the People Ganjar Pranowo, he will really make the Ganjarmahfud GanjarPresiRayaNyat Coblos"
prbowo serang ganjar debat baik banget tidak serang balik bro nyerangnya rakyat sendiri kalau misal benar pilih jadi presdien,"Prabowo Serang Ganjar Debate is really good, not attacking back bro, the people of the people themselves if for example correctly choose to be presdien"
ganjar pranowo caprs tidak kenal rakyat juga paham rangkul ragam budaya ganjar pranowo dia betul rakyat akan buat lebih rakyat ganjarpresidenrakyat ganjarmahfud coblos,"Ganjar Pranowo Caprs does not know the people also understand the embrace of Ganjar Pranowo's cultural variety, he is really the people will make the people of GanjarPresidenakyat Ganjarmahfud Coblos"
semua dukung program ganjarmahfud buat ksehatan sama tiga kali lebih sejahtera indonesia jaya ganjarmahfud dulujokowisekarangganjar coblos,All Support the Ganjarmahfud Program for Health Same Three times more prosperous Indonesia Jaya Ganjarmahfud DulujokowiSangganjar Boblos
ganjar kan cara harga pangan stabil,Ganjar is the stable food price
walah sih ganjar nyata blue eyes white dragon,"Wow, Ganjar Real Blue Eyes White Dragon"
nyala luar negeri lanjut nyala dalam negeri tanggal februari insyaallah menang menang menang ganjar klaim kantong hasil exit pol pilih umum luar negeri hasil luar biasa waras cerdas pilih ganjar yakinpilihganjar,"Overseas Flame Continue Domestic A flame on February, God willing, winning wins wins ganjar claims pocket results exit pol select general general results extraordinary results smart waras select ganjar confident"
hasil survei roy morgan prabowogibran unggul ganjarmahfud beritajogja yoyakarta jogjaistimewa,Roy Morgan Prabowogibran Survey Results Superior Ganjarmahfud beritajogja yoakyakarta jogjaist special
ganjar pranowoprof mahfud enggak mainmain libat masyarakat utama peran ibu anak program keshatan ganjar pranowo yang baik rakyat ganjarmahfud dulujokowisekarangganjar coblos,"Ganjar Pranowo Prof. Mahfud did not play to see the main community of the role of the mother of the Ganjar Pranowo Keshatan Program, the good people of Ganjarmahfud DulujokowowiSangganjar Coblos"
banyak harap titip pundak pak ganjar ganjarmahfud ganjar mahfud lbihbaik,many please close the shoulder Mr. Ganjar Ganjar Mahfud Ganjar Mahfud is better
mas ganjar didik jawa tengah makin hit kini makin semangat ajar ganjar pranowo bukti lebih baik ganjarmahfud salammtal coblos,"Mas Ganjar Didik, Central Java, the more hit now, the more enthusiasm for teaching Ganjar Pranowo, the better proof"
temu pemuda alam ganjar bicara lapang kerja hingga miskin,Gangest Youth Ganjar Ganjar Speak Work to Poor
pokok jangan pimpin pak pak ganjar kalau pak lanjut putar ikut,"point, don't lead Mr. Ganjar, if you continue to play it"
ganjarmahfud bukan janji aksi konkret sukses ganjar bangun sehat masyarakat jawa tengah ukir bukti nyata tiga kali lebih sejahtera indonesia jaya awang ganjarpresidenrakyat ganjarmahfud coblos,Ganjarmahfud is not a promise of concrete action Success Ganjar Bangun HEALTHY CENTRAL JAVA COMMUNITY TREATIVE TANGER EVIDENCE Three times more prosperous Indonesia Jaya Awang GanjarpresiKyat Ganjarmahfud Coblos
maaf pak ganjar wajah lah buat banyak meme,"Sorry, Mr. Ganjar, face for a lot of memes"
bowo mau setop bansos program jokowi ganjar lanjut bansos program jokowi lebih tepat sasar,"Bowo wants to stop the Jokowi Ganjar Program Social Association, Social Assistance of the Jokowi Program is more appropriate"
film romantis kisah cinta ganjaratikoh yoyakarta tahun an tayang stasiun televisi nasional lama hari sambut valentine day februari vot love,Romantic Film Love Story Ganjar Atikoh Yogyakarta Annual Air Television Station Long Welcome Valentine Day February Vot Love
mas ganjar calon presiden ajak rakyat banda neira jadi bagi ubah positif ganjar pranowo bukti sejahtera ganjarmahfud dulujokowisekarangganjar coblos,"Mas Ganjar, a presidential candidate, invited the people of Banda Neira to be a positive change in Ganjar Pranowo Evidence of Prosperous Ganjarmahfud DulujokowiSangganjar Boy"
ganjarmahfud tandem siap beri pasti ekonomi indonesia ganjar pranowo yang baik rakyat ganjarmahfud dulujokowisekarangganjar coblos,Ganjarmahfud Tandem Ready to Give Certainly the Indonesian Economy Ganjar Pranowo is a good people of Ganjarmahfud DulujokowiSangganjar Boblos
istana bantah pasu aman presiden jokowi aniaya dukung ganjar gunungkidul beritajogja yoyakarta jogjaistimewa,Palace denies Pasu Safe President Jokowi to support Ganjar Gunungkidul beritajogja yoakyakarta jogjaist special
coblos ganjar masalah ganjar kalah putar pertama asal yang menang putar langsung,Coblos Ganjar Ganjar Problem Lose First Playing Origin of Winning Directly Turn
mas ganjar contoh nyata orang pimpin tak kampanye juga resap makna sjarah banda neira sama ganjar sejahtera ganjarmahfud dulujokowisekarangganjar coblos,"Mas Ganjar, a real example of a non -campaign, also a recapitulation of the meaning of Sjarah Banda Neira and Ganjar Sejahtera Ganjarmahfud DulujokowowiSangganjar Coblos"
jadi ingat judul lagu pan dalam mungkin hari hasto pusing elektabilitas terus urut pertama ganjar malah makin nyungsep,so remember the title of the song Pan in maybe Hasto Hasto Dizzy Electability and the first sequence of Ganjar even more nyungsep
ganjar memang the real mvp bawa semangat sekolahsekolah jawa tengah lewat program keren gubernur ajar ganjar pranowo kamu hak dapat baik ganjarmahfud salammtal coblos,Ganjar is indeed the real MVP to bring the spirit of the Central Java school through the cool program of the Governor of Governor Ganjar Pranowo.
