full_text,tweet_english
rasa malu jokowi bansos uang rakyat malah buat kampanye anak pagi iraq ria ricis palestina ganjar pranowo vina elkan,shame Jokowi Social Association of Public Money Instead for the Campaign of Iraq Ria Ricis Palestine Palestinian Children Ganjar Pranowo Vina Elkan
debat ganjar beri gambar jelas bagaimana didik gratis jadi kunci maju masyarakat ganjar pranowo dia betul rakyat akan buat lebih rakyat ganjarmahfud dulujokowisekarangganjar coblos,"The Ganjar debate gives a clear picture of how free students are the key to the advanced community of Ganjar Pranowo, he is really the people will make the people of Ganjarmahfud DulujokowiSangganjar Boblos"
lalu alam wakil rakyat mas ganjar mahfud bukti diri wakil setia komitmen bawa aspirasi rakyat tingkat nasional ganjar pranowo kamu hak ganjarmahfud dulujokowisekarangganjar coblos,"Then the natural representative of the people, Ganjar Mahfud, proof that the representatives of loyal commitment to bring the aspirations of the people of the national level Ganjar Pranowo, you are the right"
masyarakat optimis ganjarmahfud bawa indonesia level lebih tinggi masa depan sama ganjar sejahtera ganjarmahfud salammtal coblos,the community is optimistic that Ganjarmahfud brings Indonesia's higher level of the future with Ganjar Sejahtera Ganjarmahfud Salammtal Coblos
ganjar mahfud makin kukuh posisi benak masyarakat semarang lewat kampanye megah tiga kali lebih sejahtera indonesia hebat ganjarmahfud dulujokowisekarangganjar coblos,Ganjar Mahfud is increasingly steady position of the minds of the people of Semarang through a magnificent campaign three times more prosperous Indonesia Ganjarmahfud DulujokowiSangganjar Coblos
mas ganjar bukti pimpin hanya jabat juga layan peduli rakyat ganjar pranowo bukti sejahtera ganjarmahfud dulujokowisekarangganjar coblos,"Mas Ganjar Evidence of the leader is also a jabat and the people care about the people of Ganjar Pranowo, proof that Prosperous Ganjarmahfud DulujokowowiSangganjar is voting"
random banget satu light rail transit sama ganjar pagi buta,very random one light rail transit with ganjar morning blind
ganjar pranowo bangun reputasi pimpin tidak pandai bicara juga milik berani tindak sejahtera prajurit tentara nasional indonesia polisi republik indonesia ganjar pranowo yang baik ganjarmahfud ganjarpresidenrakyat kratonbersamarakyat,Ganjar Pranowo Bangun Bangun Lead reputation not to speak also belongs to the dare of the prosperity of Indonesian National Army soldiers of the Republic of Indonesia Ganjar Pranowo who is good
pak ganjar pak mahfud tunjuk berani hadap tantang cipta infrastruktur internet kualitas ganjar pranowo kamu hak dapat baik ganjarmahfud dulujokowisekarangganjar coblos,"Mr. Ganjar Pak Mahfud pointed out bold to the challenge of the Cipta Internet infrastructure, Ganjar Pranowo Quality, You Right to be good Ganjarmahfud DulujokowowiSangganjar Coblos"
hadir ahok makin tambah kuat optimistis raih menang khusus daerah khusus ibukota jakarta,Present Ahok became more stronger optimistic about winning specifically for the Special Capital Region of Jakarta
pak ganjar pranowo pimpin gagah rakyat,Pak Ganjar Pranowo leads the people
sama ganjarmahfud perempuan indonesia kontribusi aktif mnangkan indonesia ganjar pranowo dia betul rakyat akan buat lebih rakyat ganjarmahfud ganjarpresidenrakyat kratonbersamarakyat,Same Ganjarmahfud Indonesian Women's Active Contribution to Men Indonesia Ganjar Pranowo He is really the people will make the people of Ganjarmahfud GanjarpresiKyat KratonBersamarakyat
bukti debat mas ganjar mampu hadir solusi banyak cakap pimpin tahu cara tindak sama ganjar sejahtera ganjarmahfud dulujokowisekarangganjar coblos,Proof of Debate Mas Ganjar is able to attend a lot of capable solutions to lead to how to act with Ganjar Sejahtera Ganjarmahfud DulujokowiSangganjar Boblos
tiap sempat debat ganjar beri wawas jelas kena langkahlangkah konkret kurang miskin ganjar pranowo bukti sejahtera ganjarmahfud dulujokowisekarangganjar coblos,"every time the debate Ganjar gave a Vice Mayor clearly hit by a concrete steps less poor, Ganjar Pranowo, proof of prosperous Ganjarmahfud DulujokowowiSangganjar, voted"
generasi z bangga jadi bagi jalan ganjarmahfud tuju hasil ganjar pranowo kamu hak dapat baik ganjarmahfud salammtal coblos,"Generation Z is proud to be for the road for Ganjarmahfud to the results of Ganjar Pranowo, you are the right to be good, Ganjarmahfud Salammtal Coblos"
pilih perempuan harga kontributor utama maju bangsa ganjar pranowo lalu kartini maju sama ganjar sejahtera ganjarmahfud dulujokowisekarangganjar coblos,Choose Women's Prices for the Main Contributor of Majar Pranowo Nation then Kartini advanced with Ganjar Sejahtera Ganjarmahfud DulujokowiSangganjar Boblos
ganjar tidak dadi gubernur ijih mbok salahne sit,Ganjar Not Dadi Governor Ijih Mbok Salahne Sit
sikap ganjar pranowo ingat bahwa politik tentang layan rakyat bukan penting pribadi sama ganjar sejahtera dimple ganjarmahfud dulujokowisekarangganjar coblos,The attitude of Ganjar Pranowo remembers that politics about the people's services is not important as a personal as well as Ganjar Sejahtera Dimple Ganjarmahfud DulujokowiSangganjar Boblos
dulu pilih jokowi sekarang pilih ganjar mereka milik pandang progresif ekonomi ganjar pranowo bukti lebih baik ganjarmahfud ganjarpresidenrakyat coblos,"In the past, Jokowi now selects their Ganjar belonging to the progressive economic view of Ganjar Pranowo, the evidence is better"
lalu padu salam mtal visi ganjar mahfud cipta harmoni bawa optimisme masa depan indonesia sama ganjar sejahtera nting ganjarmahfud dulujokowisekarangganjar coblos,Then the solid greetings of Mtal Vision Ganjar Mahfud Cipta Harmoni Bring Indonesia's Future Optimism and Ganjar Sejahtera Nting Ganjarmahfud DulujokowowiSangganjar Coblos
kombinasi intelektualitas empati ganjar sangat butuh indonesia ini ganjar pranowo kamu hak dapat baik ganjarmahfud dulujokowisekarangganjar coblos,"The intellectual combination of Ganjar empathy really needs Indonesia, Ganjar Pranowo, your right can be good"
gue mimpi ganjar sandiaga uno tumpang rumah gue anjrit,I dream of Ganjar Sandiaga Uno overlapping my house Anjrit
selamat datang pak ganjar pontianakinside pontianakmedia fakta kalbar idn kalbar detikpontianak detikkalbar kalbarinside,Welcome to Pak Ganjar Pontianak Insidepontianak Media Facts of West Kalimantan Idn Kalbar detikPontianak detikKalbar Kalbarinside
rakyat nilai ganjar mahfud bukan pasang caprescawapres juga bagai semangat ubah positif ganjar pranowo kamu hak dapat baik ganjarmahfud ganjarpresidenrakyat kratonbersamarakyat,The people of the value of Ganjar Mahfud are not pairs of vice presidential candidates as well as the spirit of positive change Ganjar Pranowo you right to be good ganjarmahfud ganjarpresidenakyat kratonbersamarakyat
pundak ganjarmahfud moral etika hanya jaga tingkat cermin kualitas pimpin sejahtera lipat ganda indonesia makmur sentosa ganjarmahfud ganjarpresidenrakyat kratonbersamarakyat,The shoulders of the Moral Ethics Moral only maintain the level of mirror quality of the quality of the Indonesian double prosperous Makmur Sentosa Ganjarmahfud GanjarpresiKyat KratonBersamarakyat
ganjarmahfud solusi ksehatan enggak mainmain serius banget nih ganjar pranowo bukti sejahtera ganjarmahfud dulujokowisekarangganjar coblos,"Ganjar Mahfud Health Solution does not play seriously, Ganjar Pranowo Proof of Prosperous Ganjarmahfud DulujokowiSangganjar Boblos"
soraksorai salam metal rakyat jawa barat tanda jalan politik pak ganjar pak mahfud menang sama ganjar pranowo bukti lebih baik ytwr ganjarmahfud dulujokowisekarangganjar coblos,SORAKSORAI SALAKST METAL PEOPLE WEST JAVA POLITICAL SIGNS Pak Ganjar Pak Mahfud won with Ganjar Pranowo Evidence better YTWR Ganjarmahfud DulujokowowiSangganjar Coblos
antusiasme masyarakat begitu tinggi konser salam mtal cipta gelombang dukung gairah kandidat ganjar mahfud ganjar pranowo bukti lebih baik ajol ganjarmahfud dulujokowisekarangganjar coblos,The enthusiasm of the community is so high in the concert of MTAL Cipta Wave Supports the passion of the candidate Ganjar Mahfud Ganjar Pranowo Evidence is better Ajol Ganjarmahfud DulujokowiSangganjar Coblos
perempuan indonesia bersamasama bisa mnangkan ganjarmahfud bukti kuat sama ganjar sejahtera wildan ganjarmahfud ganjarpresidenrakyat kratonbersamarakyat,Indonesian women together can fight Ganjarmahfud strong evidence with Ganjar Sejahtera Wildan Ganjarmahfud GanjarpresiKyat KratonBersamarakyat
kepala goyang ganjar jadi ladang cuan,Ganjar Shake Head Becomes a Cuan Field
harap ganjar lolos putar dua prabowo,Please Ganjar passed the two Prabowo
kd antusias dukung ganjarmahfud,KD is enthusiastic about supporting Ganjarmahfud
haha keren ganjar sekali tabok tiga serdadu terkaingkaing,haha cool tabok three soldiers
hampir jarang dapat sama keluarga ayah pas kumpul keluarga banyak terang pilih ganjar hampir semua keluarga besar gue akhir lega kurang dukung prabowo,Almost rarely can be the same as my father's family when a family gathering a lot bright
sih jokowi kunjung klaten mobil tidak mau jalan pelanpelan sih jokowi panik daerah sendiri tolak sama warga nya teriakteriak mau pilih ganjarmahfud,"Jokowi visit Klaten the car does not want to walk slowly, Jokowi panicked his own area with his residents shouting to choose Ganjarmahfud"
bangga punya sosok calon presiden kayak ganjar punya peduli luar biasa dunia didik tanah air ganjar pranowo bukti sejahtera ganjarmahfud salammtal coblos,proud to have a presidential candidate like Ganjar has an extraordinary caring for the world of Didik Motherland Ganjar Pranowo Proof of Prosperous Ganjarmahfud Salammtal Coblos
ganjar coba cat merah muda,Ganjar Try Pink Paint
ganjar pranowo bawa semangat positif lalu pnilaian intgritas tingkat kualitas perintah seluruh indonesia ganjar pranowo bukti lebih baik ganjarmahfud ganjarpresidenrakyat kratonbersamarakyat,Ganjar Pranowo brought a positive spirit and then evaluated the level of quality of the quality of the commands of the entire Indonesian Ganjar Pranowo Evidence better Ganjarmahfud GanjarPresidenrakyat KratonBersamarakyat
ganjarmahfud harap baru indonesia sikap hormat kaum perempuan ganjar pranowo yang baik rakyat ganjarmahfud dulujokowisekarangganjar coblos,Ganjarmahfud hopes that the new Indonesian respectful attitude of the Ganjar Pranowo women who are good people of Ganjarmahfud DulujokowiSangganjar votes
dante anjing wkwk nanti rambur begini trendsetternya pak ganjar icon,Dante Dog wkwk later rambur like this trendsetter Mr. Ganjar Icon
ganjarmahfud bukan janji nyata kontribusi ksehatan masyarakat desa ganjar pranowo kamu hak dapat baik ganjarmahfud dulujokowisekarangganjar coblos,Ganjar Mahfud is not a real promise of the contribution of the health of the community of Ganjar Pranowo Village.
dukung pak ganjar sama pak benar lihat penuh stadion kemarin glba sih padat coba kita cek bagaimana gelora bung karno waktu gue rewatch debat calon presiden buat tentu pilih,"Support Mr. Ganjar and Sir, right seeing the stadium yesterday, GLBA is busy, let's check how Bung Karno's stadium when I rewatch the presidential candidate debate for of course choosing"
,Nan
aku coba prediksi antara ganjar nyata menang jon jones guys,I tried to predict between Ganjar Real Winning Jon Jones Guys
pak ganjar pak mahfud lihat depan yakin internet super cepat jadi indonesia pimpin dunia digital ganjar pranowo bukti sejahtera ganjarmahfud dulujokowisekarangganjar coblos,Pak Ganjar Pak Mahfud See Front Be sure the internet is super fast so Indonesia has a digital world ganjar pranowo proof that Prosperous Ganjarmahfud DulujokowiSangganjar Boblos
faktor kunci gagal ganjar karena khianat jokowi,The key factor failed to Ganjar because of Jokowi's betrayal
visi ganjarmahfud seni buka peluang besar industri kreatif ganjar pranowo kamu hak dapat baik ganjarmahfud salammtal coblos,Vision of Ganjarmahfud Art Open the Great Opportunities Creative Industry Ganjar Pranowo You Right to be good Ganjarmahfud Salammtal Coblos
i hate to sayang this but yel draw ganjar like gojo satoru fr real it looks sok good ,I hate to dear this but yel draw Ganjar like gojo satoru fr. Real it looks pretentious good
politik list counter dukung kalau bilang gibran nepotisme dulu sama ganjar pernah rebut gibran langgar ham disuruhisu angkat tahun sekali jokowi kampanye ada bukti jokowi bicara dukung jangan pilih cont,Politics List Counter Supports if Gibran Nepotism used to be the same as Ganjar who had taken Gibran Langgar HAM was told to adopt once a year Jokowi campaign There was evidence of Jokowi Speaking Do not choose Cont.
alam ganjar is the anak organisasi kampus kamu had a besar crush for sok long then kamu finally talk cuma malam sibuk organisasi isi bicara badan eksekutif mahasiswa isu kampus terus adekadekannya banyak,Nature Ganjar is the child of your campus organization you have a big crush for longing you you finally talk about just a busy night organization.
langkah konkret ganjarmahfud selaras butuh digital beri internet gratis sekolahsekolah patut acung jempol ganjar pranowo bukti sejahtera ganjarmahfud dulujokowisekarangganjar coblos,Concrete Step Ganjarmahfud Selaras Needs Digital Give Free Internet School Detailed School Ganjar Pranowo Proof Prosperous Ganjarmahfud DulujokowowiSangganjar Coblos
pak ganjar tantang pemuda bekas beres bantargebang ganjarmahfud ganjarmahfudmnangdebat,"Pak Ganjar Challenges the Used Youths, Bantargebang Ganjarmahfud Ganjarmahfudmnang Legis"
pak mahfud mas ganjar menggarisbawahi penting akses internet cepat maju bangsa tiga kali lebih sejahtera indonesia jaya ganjarmahfud dulujokowisekarangganjar coblos,Pak Mahfud Mas Ganjar underlined the important access to the fast internet advances for the nation three times more prosperous Indonesia Jaya Ganjarmahfud DulujokowiSangganjar Boblos
semarang pancen senang kopi pinggir jalan cita rasa kayak coffeshop nama soal harga jangan tanya murah banget pasti,Semarang Pancen is happy that the roadside coffee tastes like coffeshop names about prices don't ask really cheap
lmao an empty stadium and ganjar voodoo will taking them into trenches,lmao an empty stadium and ganjar voodoo will take them into trenches
ganjar pranowo sosok bawa angin segar dunia pndidikan tanah air ganjar pranowo kamu hak dapat baik ganjarmahfud slankganjarmahfud coblos,Ganjar Pranowo Figure Bringing the Fresh Air for the World Education Ganjar Pranowo You Right to Be Good Ganjarmahfud Slankganjarmahfud Coblos
ganjar pranowoprof mahfud bikin program kartu tanda duduk sakti bikin keren data masyarakat jadi lebih gampang buka sama ganjar sejahtera ganjarmahfud dulujokowisekarangganjar coblos,Ganjar Pranowoprof Mahfud makes the Sakti Sitting Identity Card program makes it cool to the data of the community so it is easier to open the same as Ganjar Sejahtera Ganjarmahfud DulujokowowiSangganjar Coblos
anak hak dapat akses pndidikan layak kita usaha itu ucap ganjar penuh tanggung jawab ganjar pranowo dia betul rakyat akan buat lebih rakyat bnl ganjarmahfud salammtal coblos,"The child cannot access education deserves our business, said Ganjar, full of responsibility for Ganjar Pranowo, he is really the people will make the people of BNL Ganjarmahfud Salammtal votes"
dukung buat ganjarmahfud biar ksehatan masyarakat terus juang ganjar pranowo bukti sejahtera ganjarmahfud dulujokowisekarangganjar coblos,Support for Ganjarmahfud so that the health of the community continues to fight Ganjar Pranowo Prosperous Evidence of Ganjarmahfud DulujokowiSangganjar Boblos
ganjar for ri,Ganjar for Ri
ganjar mahfud tegas anti politik dinasti langkah awal wujud perintah adil ganjar pranowo dia betul rakyat akan buat lebih rakyat ganjarmahfud ganjarpresidenrakyat coblos,Ganjar Mahfud firmly Anti -Political Dynasty The first step in the manifestation of Ganjar Pranowo's fair commands he will really make the people of Ganjarmahfud Ganjarpresidenakyat Coblos
pokok e ganjar lek ganjar iya mahfud lek ganjar mahfud iya nomor kamisudahpintar kamipilihganjar gasssganjarmahfud,Principal E Ganjar Lek Ganjar Yes Mahfud Lek Ganjar Mahfud Yes Kamisetapuan Pintar KamipilihGanjar Gasssganjarmahfud
ganjar pranowo beri peluang sejati perempuan tumbuh kembang lewat kartini maju ganjar pranowo bukti lebih baik ganjarmahfud dulujokowisekarangganjar coblos,Ganjar Pranowo gives a true opportunity for women to grow and develop through Kartini forward Ganjar Pranowo Evidence is better for Ganjarmahfud DulujokowiSangganjar Publos
pak ganjar,Mr. Ganjar
slank rilis lagu salam mtal bakal bawa konser akbar ganjar gelora bung karno band legendaris slank sama musisi budayawan aktivis dukung ganjar pranowomahfud md luncur single lagu baru judul salam mtal lagu bentuk dukung pasang,Slank released the song Salam Mtal Will Bring the Akbar Ganjar Gelora Bung Karno concert legendary band Slank and musician Cultural Activist Support Ganjar Pranowomahfud Md Luncur Single New Song Title Salam Salam Song Forms Supporting Pair
pak ganjar langkahlangkah konkret bukti kesjahteraan kecil wujud lalu tindak nyata bukan sekadar janji ganjar pranowo dia betul rakyat akan buat lebih rakyat ganjarmahfud ganjarpresidenrakyat coblos,Pak Ganjar steps concrete steps proof of small welfare of ablution then not real not just a promise of Ganjar Pranowo he is really the people will make more people Ganjarmahfud GanjarPresidenrakyat Coblos
gue selalu pikir begini gue tau allah maha bolak balik hati siapa tau iya kan dukung tiba pilih dulu banyak benci tiba sekarang mulai banyak suka kalau masuk putar gue bakal golput sih gue tidak mau pimpin ganjar,"I always think like this I know God is almighty, who knows, who knows, support, you will choose a lot of hate, now, now, I start to play, I will go to abstentions, I don't want to lead Ganjar"
mas ganjar nilai pimpin milik inovasi cipta solusi baik tingkat kesjahteraan anggota tentara nasional indonesia polisi republik indonesia sejahtera kali lipat indonesia hebat ganjarmahfud ganjarpresidenrakyat kratonbersamarakyat,Mas Ganjar Value of Leaders owned by Innovation Cipta Solutions Both Level of Welfare Level of Indonesian National Army Members of the Republic of Indonesia Prosperous Indonesia River Indonesia Gangest Ganjarmahfud Ganjarpresidenakyat KratonBersamarakyat
lalu debat calon presiden pak ganjar sukses cipta citra pimpin mampu beri solusi konkret tingkat kualitas didik ganjar pranowo bukti lebih baik ganjarmahfud dulujokowisekarangganjar coblos,Then the debate of presidential candidate Pak Ganjar Sukses Cipta Citra Lead is able to provide concrete solutions levels of student quality Ganjar Pranowo Better Ganjarmahfud DulujokowowiSangganjar Coblos
sama rakyat hajat rakyat salam mtal cipta semangat juang baru ayo ramai ganjar pranowo dia betul rakyat akan buat lebih rakyat ganjarmahfud ganjarpresidenrakyat kratonbersamarakyat,"with the people of the people of the people, greetings, Mtal, Cipta Semangat Baru, let's be crowded with Ganjar Pranowo, he is right for the people to make the people of Ganjarmahfud Ganjarpresidenakyat KratonBersamarakyat"
ganjar bukti kuasa jalan harus hilang kontak rakyat ganjar pranowo yang baik rakyat ganjarpresidenrakyat ganjarmahfud coblos,Ganjar Evidence of the power of the road must lose the good contact of the Ganjar Pranowo People's GanjarPresidat Ganjarmahfud Coblos
benar aku bebas mau presiden ganjar asal rakyat bukan kalian,"It's true that I'm free to want the president of Ganjar from the people, not you guys"
pak ganjar pak mahfud yakin akses internet kunci tara maju sama ganjar sejahtera ganjarmahfud dulujokowisekarangganjar coblos,Pak Ganjar Pak Mahfud believes that the internet access to the key to the key to Ganjar Sejahtera Ganjarmahfud DulujokowiSangganjar Coblos
ganjar mahfud harap mampu beri sentuh ajaib kuat sektor usaha mikro kecil tengah indonesia ganjar pranowo bukti sejahtera ganjarmahfud dulujokowisekarangganjar coblos,"Ganjar Mahfud, please be able to give a strong touch of the Micro Small Business Sector in the middle of Indonesia, Ganjar Pranowo, prosperous proof"
sih malu mundur sendiri,I am ashamed to retreat
ganjar guru kece ajar anti korupsi wawas bangsa ngehindarin bullying gila kan ganjar pranowo yang baik rakyat vannprtma ganjarmahfud salammtal coblos,Ganjar Teacher Teaching Anti -Corruption Wawas Bangsa Ngehindarin Bullying Crazy Kan Ganjar Pranowo who is good people vannprtma ganjarmahfud salammtal votes
satu putar persen prabowogibran kuat aniesmuhaimin stagnan ganjar mahfud terus turun by indikator politik indonesia,One Percent of Prabowogibran Aniesmuhaimin Stagnant Stagnant Ganjar Mahfud continues to go down by Indonesian political indicators
js rimba n f arie dzadina alyani   mahfud kimmi,JS Rimba N F Arie Dzadina Alyani Mahfud Kimmi
libat pak ganjarprof mahfud hajat rakyat cipta atmosfer begitu akrab sahaja ganjar pranowo yang baik rakyat ganjarmahfud ganjarpresidenrakyat coblos,Libat Pak Ganjarprof Mahfud Hajat Rakyat Cipta Atmosphere is so familiar Sahaja Ganjar Pranowo who is good people Ganjarmahfud Ganjarpresidenakyat Coblos
benar baru sadar kalau pak ganjar mirip bapak gueh gara sarah bicara,It was true that I realized that Mr. Ganjar was similar to Mr. Gueh because Sarah spoke
ganjar bukan pimpin puncak juga sahabat selalu di hidup masyarakat ganda sejahtera raih makmur lanjut ganjarpresidenrakyat ganjarmahfud coblos,"Ganjar is not the peak leader, but also a friend always in the lives of the Prosperous Double Community Wins Makmur, GanjarpresiKyat Ganjarmahfud Coblos"
 mahfud mangat ottis dumdum manik  stpl tetap ganjar mahfud,Mahfud Mangat Ottis Dumdum Manik STPL remains Ganjar Mahfud
upaya ganjarmahfud hadir internet gratis sekolahsekolah langkah nyata kuat fondasi didik digital sama ganjar sejahtera  ganjarmahfud dulujokowisekarangganjar coblos,Efforts to Ganjar Mahfud Present Free Internet School School Strong Strong Steps Digital Didik Foundation and Ganjar Sejahtera Ganjarmahfud DulujokowiSangganjar Plot
kampanye calon presiden bayuwangi banyak dukung susup parah sekali sih dukung cukup lembaga survei kalian akal akal jangan kampanye calon presiden kalian akal akal kurang kerja nama nya ganjarmahfud menang partai demokrasi indonesia juang hatrick,"The campaign of presidential candidates for Bayuwangi supports a lot of sizes very badly, supporting your survey institutions, your reason, don't campaign for your presidential candidate, your reason is renewal"
solidaritas yarakat solo cermin hadir yang besar kampanye akbar ganjar pranowo mahfud sama ganjar sejahtera ganjarmahfud dulujokowisekarangganjar coblos,Solidarity of Solo Mermin Jembahakat is a large grand campaign of Ganjar Pranowo Mahfud and Ganjar Sejahtera Ganjarmahfud DulujokowowiSangganjar Coblos
pak ganjar sukses cipta momentum positif debat sorot penting daya rakyat kecil ganjar pranowo bukti sejahtera themum ganjarmahfud dulujokowisekarangganjar coblos,Pak Ganjar Successful Creating Momentum Positive Momentum Debate Important Power of the Power of Small People Ganjar Pranowo Evidence of Prosperous Themum Ganjarmahfud DulujokowowiSangganjar Coblos
ganjar layak beri mandat terus visi hasil didik sudah beliau rintis jawa tengah ganjar pranowo dia betul rakyat akan buat lebih rakyat ganjarmahfud salammtal coblos,"Ganjar is worthy of being a mandate and the vision of the results of the students, he has pioneered Central Java, Ganjar Pranowo, he is really the people will make the people of Ganjarmahfud Salammtal votes"
ganjar pranowo patut acung jempol atas kerja keras jaga hormat reputasi perintah provinsi jawa tengah cermin peringkat tinggi spi ganjar pranowo yang baik ganjarmahfud ganjarpresidenrakyat kratonbersamarakyat,"Ganjar Pranowo deserves thumbs up for the hard work of keeping the reputation of the orders of Central Java Province, the high ranking of SPI Ganjar Pranowo, Ganjarmahfud GanjarPresidat KratonBersamarakyat"
apresiasi tinggi upaya pak ganjar pak mahfud md cipta sistem hukum adil efisien moga langkahlangkah beri dampak positif seluruh masyarakat ganjar pranowo bukti lebih ganjarmahfud dulujokowisekarangganjar coblos,High appreciation of the efforts of Mr. Ganjar Pak Mahfud MD Cipta Fair Legal System Efficient hope the steps to give a positive impact of the entire community of Ganjar Pranowo more Evidence of Ganjarmahfud DulujokowiSangganjar Coblos
ah film kamu memang lain mas ngeringeri sedap bikin jantung trataban bikin mulut pegal keren keren keren,"ah your movie is different, I horrified deliciously making the heart of tratanban make a cool cool cool mouth cool"
hasil exit pol bagai bahan negara sudah laku coblos negara asia eropa amerika australia amerika latin ganjar mahfud unggul negara ksa timur tengah unggul nomor buncit tumbang koalisi usak demokrasi,"The results of the exit poll as a state material have been sold by the American American American European American State Latin Ganjar Mahfud, superior to the Middle East KSA country"
ganjar yakin pndidikan bukan beban investasi baik masa depan bangsa ganjar pranowo bukti sejahtera ganjarmahfud salammtal coblos,"Ganjar believes that education is not a good investment burden for the future of the Ganjar Pranowo nation, proof of prosperous Ganjarmahfud Salammtal Coblos"
langkah ganjarmahfud beri internet gratis sangat strategis bangun generasi informasi literasi digital ganjar pranowo yang baik rakyat ganjarmahfud dulujokowisekarangganjar coblos,Step Ganjarmahfud Give Free Internet Very Strategic Building Generation of Digital Literacy Information Ganjar Pranowo The Good People of Ganjarmahfud Dulujokowowisangganjar Publos
ganjarmahfud is committed to improve slum villages in urban villages sahabatganjar ganjar ganjarpranowo,Ganjarmahfud is committed to improve Slum Villages in Urban Villages SahabatGanjar Ganjarpranowo
